CVE_ID,PublishTime,ModifyTime,Report,CVSSV3,AttackVector,AttackComplexity,PrivilegesRequired,UserInteraction,Scope,ConfidentialityImpact,IntegrityImpact,AvailabilityImpact
CVE-2014-2293,2018-03-26T18:29Z,2018-04-24T12:57Z,"Zikula Application Framework before 1.3.7 build 11 allows remote attackers to conduct PHP object injection attacks and delete arbitrary files or execute arbitrary PHP code via crafted serialized data in the (1) authentication_method_ser or (2) authentication_info_ser parameter to index.php, or (3) zikulaMobileTheme parameter to index.php.",9.8,NETWORK,LOW,NONE,NONE,UNCHANGED,HIGH,HIGH,HIGH
CVE-2014-2294,2018-04-17T19:29Z,2018-05-22T15:05Z,Open Web Analytics (OWA) before 1.5.7 allows remote attackers to conduct PHP object injection attacks via a crafted serialized object in the owa_event parameter to queue.php.,9.8,NETWORK,LOW,NONE,NONE,UNCHANGED,HIGH,HIGH,HIGH
CVE-2014-2296,2018-07-20T17:29Z,2018-09-19T13:31Z,"XML external entity (XXE) vulnerability in java/org/jasig/cas/util/SamlUtils.java in Jasig CAS server before 3.4.12.1 and 3.5.x before 3.5.2.1, when Google Accounts Integration is enabled, allows remote unauthenticated users to bypass authentication via crafted XML data.",8.8,NETWORK,LOW,NONE,REQUIRED,UNCHANGED,HIGH,HIGH,HIGH
CVE-2014-2297,2018-03-19T21:29Z,2018-10-09T19:43Z,Multiple cross-site scripting (XSS) vulnerabilities in the VideoWhisper Live Streaming Integration plugin 4.29.6 for WordPress allow remote attackers to inject arbitrary web script or HTML via the (1) n parameter to ls/htmlchat.php or (2) bgcolor parameter to ls/index.php.  NOTE: vector 1 may overlap CVE-2014-1906.4.,6.1,NETWORK,LOW,NONE,REQUIRED,CHANGED,LOW,LOW,NONE
CVE-2014-2302,2018-07-19T17:29Z,2018-09-18T14:45Z,The installer script in webEdition CMS before 6.2.7-s1 and 6.3.x before 6.3.8-s1 allows remote attackers to conduct PHP Object Injection attacks by intercepting a request to update.webedition.org.,9.8,NETWORK,LOW,NONE,NONE,UNCHANGED,HIGH,HIGH,HIGH
CVE-2014-2304,2019-10-23T18:15Z,2019-10-30T13:36Z,"A vulnerability in version 0.90 of the Open Floodlight SDN controller software could result in a denial of service attack and crashing of the controller service. This effect is the result of a flaw in OpenFlow protocol processing, where specific malformed and mistimed FEATURES_REPLY messages cause the controller service to not delete switch and port data from its internal tracking structures.",7.5,NETWORK,LOW,NONE,NONE,UNCHANGED,NONE,NONE,HIGH
CVE-2014-2312,2018-03-26T18:29Z,2019-11-20T18:08Z,The main function in android_main.cpp in thermald allows local users to write to arbitrary files via a symlink attack on /tmp/thermald.pid.,5.5,LOCAL,LOW,LOW,NONE,UNCHANGED,NONE,HIGH,NONE
CVE-2014-2323,2014-03-14T15:55Z,2021-02-26T23:50Z,"SQL injection vulnerability in mod_mysql_vhost.c in lighttpd before 1.4.35 allows remote attackers to execute arbitrary SQL commands via the host name, related to request_check_hostname.",9.8,NETWORK,LOW,NONE,NONE,UNCHANGED,HIGH,HIGH,HIGH
CVE-2014-2359,2018-04-06T16:29Z,2018-05-15T18:41Z,OleumTech Wireless Sensor Network devices allow remote attackers to obtain sensitive information about sensor nodes or spoof devices by reading cleartext protocol data.,5.9,NETWORK,HIGH,NONE,NONE,UNCHANGED,HIGH,NONE,NONE
CVE-2014-2387,2019-12-13T14:15Z,2019-12-19T20:12Z,Pen 0.18.0 has Insecure Temporary File Creation vulnerabilities,4.4,LOCAL,LOW,LOW,NONE,UNCHANGED,LOW,LOW,NONE
CVE-2014-2526,2014-03-25T18:21Z,2021-05-27T16:42Z,"Multiple cross-site scripting (XSS) vulnerabilities in BarracudaDrive before 6.7 allow remote attackers to inject arbitrary web script or HTML via the (1) sForumName or (2) sDescription parameter to Forum/manage/ForumManager.lsp; (3) sHint, (4) sWord, or (5) nId parameter to Forum/manage/hangman.lsp; (6) user parameter to rtl/protected/admin/wizard/setuser.lsp; (7) name or (8) email parameter to feedback.lsp; (9) lname or (10) url parameter to private/manage/PageManager.lsp; (11) cmd parameter to fs; (12) newname, (13) description, (14) firstname, (15) lastname, or (16) id parameter to rtl/protected/mail/manage/list.lsp; or (17) PATH_INFO to fs/.",6.1,NETWORK,LOW,NONE,REQUIRED,CHANGED,LOW,LOW,NONE
CVE-2014-2532,2014-03-18T05:18Z,2018-07-19T01:29Z,"sshd in OpenSSH before 6.6 does not properly support wildcards on AcceptEnv lines in sshd_config, which allows remote attackers to bypass intended environment restrictions by using a substring located before a wildcard character.",4.9,NETWORK,HIGH,LOW,NONE,CHANGED,LOW,LOW,NONE
CVE-2014-2550,2018-03-19T21:29Z,2018-04-17T14:57Z,Cross-site request forgery (CSRF) vulnerability in the Disable Comments plugin before 1.0.4 for WordPress allows remote attackers to hijack the authentication of administrators for requests that enable comments via a request to the disable_comments_settings page to wp-admin/options-general.php.,8.8,NETWORK,LOW,NONE,REQUIRED,UNCHANGED,HIGH,HIGH,HIGH
CVE-2014-2552,2018-04-27T16:29Z,2018-06-06T13:11Z,"Brookins Consulting (BC) Collected Information Export extension for eZ Publish 1.1.0 does not properly restrict access, which allows remote attackers to gain access to sensitive data.",9.8,NETWORK,LOW,NONE,NONE,UNCHANGED,HIGH,HIGH,HIGH
CVE-2014-2560,2020-02-12T14:15Z,2020-02-14T15:30Z,"The PhonerLite phone before 2.15 provides hashed credentials in a response to an invalid authentication challenge, which makes it easier for remote attackers to obtain access via a brute-force attack, related to a ""SIP Digest Leak"" issue.",7.5,NETWORK,HIGH,NONE,REQUIRED,UNCHANGED,HIGH,HIGH,HIGH
CVE-2014-2581,2020-01-28T15:15Z,2020-01-30T17:00Z,"Smb4K before 1.1.1 allows remote attackers to obtain credentials via vectors related to the cuid option in the ""Additional options"" line edit.",7.5,NETWORK,LOW,NONE,NONE,UNCHANGED,HIGH,NONE,NONE
CVE-2014-2592,2018-03-09T20:29Z,2018-03-27T19:59Z,Unrestricted file upload vulnerability in Aruba Web Management portal allows remote attackers to execute arbitrary code by uploading a file with an executable extension.,9.8,NETWORK,LOW,NONE,NONE,UNCHANGED,HIGH,HIGH,HIGH
CVE-2014-2595,2020-02-12T01:15Z,2020-02-20T15:55Z,Barracuda Web Application Firewall (WAF) 7.8.1.013 allows remote attackers to bypass authentication by leveraging a permanent authentication token obtained from a query string.,9.8,NETWORK,LOW,NONE,NONE,UNCHANGED,HIGH,HIGH,HIGH
CVE-2014-2650,2020-01-09T13:15Z,2020-01-17T14:38Z,Unify OpenStage / OpenScape Desk Phone IP before V3 R3.11.0 SIP has an OS command injection vulnerability in the web based management interface,9.8,NETWORK,LOW,NONE,NONE,UNCHANGED,HIGH,HIGH,HIGH
CVE-2014-2651,2020-01-09T13:15Z,2020-01-21T21:00Z,Unify OpenStage/OpenScape Desk Phone IP SIP before V3 R3.11.0 has an authentication bypass in the default mode of the Workpoint Interface,9.8,NETWORK,LOW,NONE,NONE,UNCHANGED,HIGH,HIGH,HIGH
CVE-2014-2652,2018-03-19T21:29Z,2018-04-20T14:22Z,SQL injection vulnerability in OpenScape Deployment Service (DLS) before 6.x and 7.x before R1.11.3 allows remote attackers to execute arbitrary SQL commands via unspecified vectors.,9.8,NETWORK,LOW,NONE,NONE,UNCHANGED,HIGH,HIGH,HIGH
CVE-2014-2664,2017-10-17T15:29Z,2017-11-08T17:25Z,"Unrestricted file upload vulnerability in the ProfileController::actionUploadPhoto method in protected/controllers/ProfileController.php in X2Engine X2CRM before 4.0 allows remote attackers to execute arbitrary code by uploading a file with an executable extension, then accessing it via a direct request to the file in an unspecified directory.",8.8,NETWORK,LOW,LOW,NONE,UNCHANGED,HIGH,HIGH,HIGH
CVE-2014-2674,2018-03-19T21:29Z,2018-04-18T18:26Z,Directory traversal vulnerability in the Ajax Pagination (twitter Style) plugin 1.1 for WordPress allows remote attackers to read arbitrary files via a .. (dot dot) in the loop parameter in an ajax_navigation action to wp-admin/admin-ajax.php.,7.5,NETWORK,LOW,NONE,NONE,UNCHANGED,HIGH,NONE,NONE
CVE-2014-2675,2018-03-19T21:29Z,2018-04-18T18:23Z,Cross-site request forgery (CSRF) vulnerability in inc/AdminPage.php in the WP HTML Sitemap plugin 1.2 for WordPress allows remote attackers to hijack the authentication of administrators for requests that delete the sitemap via a request to the wp-html-sitemap page in wp-admin/options-general.php.,6.5,NETWORK,LOW,NONE,REQUIRED,UNCHANGED,NONE,HIGH,NONE
CVE-2014-2680,2020-01-21T19:15Z,2020-01-30T19:18Z,The update process in Xmind 3.4.1 and earlier allow remote attackers to execute arbitrary code via a man-in-the-middle attack.,8.1,NETWORK,HIGH,NONE,NONE,UNCHANGED,HIGH,HIGH,HIGH
CVE-2014-2686,2020-01-09T13:15Z,2020-01-21T16:01Z,Ansible prior to 1.5.4 mishandles the evaluation of some strings.,7.5,NETWORK,LOW,NONE,NONE,UNCHANGED,NONE,HIGH,NONE
CVE-2014-2710,2017-04-13T14:59Z,2018-10-09T19:43Z,Multiple cross-site scripting (XSS) vulnerabilities in Oliver (formerly Webshare) 1.3.1 and earlier allow remote attackers to inject arbitrary web script or HTML via the PATH_INFO to the (1) login page (index.php) or (2) login form (loginform-inc.php).,6.1,NETWORK,LOW,NONE,REQUIRED,CHANGED,LOW,LOW,NONE
CVE-2014-2721,2020-03-19T16:15Z,2020-03-23T16:33Z,"In FortiBalancer 400, 1000, 2000 and 3000, a platform-specific remote access vulnerability has been discovered that may allow a remote user to gain privileged access to affected systems using SSH. The vulnerability is caused by a configuration error, and is not the result of an underlying SSH defect.",8.8,NETWORK,LOW,LOW,NONE,UNCHANGED,HIGH,HIGH,HIGH
CVE-2014-2722,2020-03-19T16:15Z,2020-03-23T16:33Z,"In FortiBalancer 400, 1000, 2000 and 3000, a platform-specific remote access vulnerability has been discovered that may allow a remote user to gain privileged access to affected systems using SSH. The vulnerability is caused by a configuration error, and is not the result of an underlying SSH defect.",8.8,NETWORK,LOW,LOW,NONE,UNCHANGED,HIGH,HIGH,HIGH
CVE-2014-2723,2020-03-19T16:15Z,2020-03-23T16:33Z,"In FortiBalancer 400, 1000, 2000 and 3000, a platform-specific remote access vulnerability has been discovered that may allow a remote user to gain privileged access to affected systems using SSH. The vulnerability is caused by a configuration error, and is not the result of an underlying SSH defect.",8.8,NETWORK,LOW,LOW,NONE,UNCHANGED,HIGH,HIGH,HIGH
CVE-2014-2727,2020-02-19T14:15Z,2020-02-25T17:55Z,The STARTTLS implementation in MailMarshal before 7.2 allows plaintext command injection.,9.8,NETWORK,LOW,NONE,NONE,UNCHANGED,HIGH,HIGH,HIGH
CVE-2014-2843,2020-01-31T18:15Z,2020-02-04T17:40Z,Cross-site scripting (XSS) vulnerability in infoware MapSuite MapAPI 1.0.x before 1.0.36 and 1.1.x before 1.1.49 allows remote attackers to inject arbitrary web script or HTML via unspecified vectors.,6.1,NETWORK,LOW,NONE,REQUIRED,CHANGED,LOW,LOW,NONE
CVE-2014-2845,2017-11-15T18:29Z,2019-12-11T15:20Z,"Cyberduck before 4.4.4 on Windows does not properly validate X.509 certificate chains, which allows man-in-the-middle attackers to spoof FTP-SSL servers via a certificate issued by an arbitrary root Certification Authority.",5.9,NETWORK,HIGH,NONE,NONE,UNCHANGED,HIGH,NONE,NONE
CVE-2014-2875,2020-02-06T16:15Z,2020-03-06T16:15Z,"The session.lua library in CGILua 5.2 alpha 1 and 5.2 alpha 2 uses weak session IDs generated based on OS time, which allows remote attackers to hijack arbitrary sessions via a brute force attack. NOTE: CVE-2014-10399 and CVE-2014-10400 were SPLIT from this ID.",6.1,NETWORK,LOW,NONE,REQUIRED,CHANGED,LOW,LOW,NONE
CVE-2014-2884,2018-03-19T21:29Z,2018-04-20T14:25Z,The ProcessVolumeDeviceControlIrp function in Ntdriver.c in TrueCrypt 7.1a allows local users to bypass access restrictions and obtain sensitive information about arbitrary files via a (1) TC_IOCTL_OPEN_TEST or (2) TC_IOCTL_GET_SYSTEM_DRIVE_CONFIG IOCTL call.,3.3,LOCAL,LOW,LOW,NONE,UNCHANGED,LOW,NONE,NONE
CVE-2014-2885,2018-03-19T21:29Z,2018-04-20T14:36Z,Multiple integer overflows in TrueCrypt 7.1a allow local users to (1) obtain sensitive information via vectors involving a crafted item->OriginalLength value in the MainThreadProc function in EncryptedIoQueue.c or (2) cause a denial of service (memory consumption) via vectors involving large StartingOffset and Length values in the ProcessVolumeDeviceControlIrp function in Ntdriver.c.,7.1,LOCAL,LOW,LOW,NONE,UNCHANGED,HIGH,NONE,HIGH
CVE-2014-2896,2020-01-28T16:15Z,2020-02-04T19:15Z,"The DoAlert function in the (1) TLS and (2) DTLS implementations in wolfSSL CyaSSL before 2.9.4 allows remote attackers to have unspecified impact and vectors, which trigger memory corruption or an out-of-bounds read.",9.8,NETWORK,LOW,NONE,NONE,UNCHANGED,HIGH,HIGH,HIGH
CVE-2014-2897,2020-01-28T16:15Z,2020-02-04T19:06Z,"The SSL 3 HMAC functionality in wolfSSL CyaSSL 2.5.0 before 2.9.4 does not check the padding length when verification fails, which allows remote attackers to have unspecified impact via a crafted HMAC, which triggers an out-of-bounds read.",9.8,NETWORK,LOW,NONE,NONE,UNCHANGED,HIGH,HIGH,HIGH
CVE-2014-2898,2020-01-28T16:15Z,2020-02-04T19:02Z,"wolfSSL CyaSSL before 2.9.4 allows remote attackers to have unspecified impact via multiple calls to the CyaSSL_read function which triggers an out-of-bounds read when an error occurs, related to not checking the return code and MAC verification failure.",9.8,NETWORK,LOW,NONE,NONE,UNCHANGED,HIGH,HIGH,HIGH
CVE-2014-2901,2019-11-21T23:15Z,2019-12-04T14:16Z,wolfssl before 3.2.0 does not properly issue certificates for a server's hostname.,7.5,NETWORK,LOW,NONE,NONE,UNCHANGED,NONE,HIGH,NONE
CVE-2014-2902,2019-11-21T23:15Z,2019-12-04T14:16Z,wolfssl before 3.2.0 does not properly authorize CA certificate for signing other certificates.,7.5,NETWORK,LOW,NONE,NONE,UNCHANGED,NONE,HIGH,NONE
CVE-2014-2903,2017-10-06T15:29Z,2017-10-17T15:59Z,"CyaSSL does not check the key usage extension in leaf certificates, which allows remote attackers to spoof servers via a crafted server certificate not authorized for use in an SSL/TLS handshake.",5.9,NETWORK,HIGH,NONE,NONE,UNCHANGED,HIGH,NONE,NONE
CVE-2014-2904,2019-11-21T23:15Z,2019-12-04T14:16Z,wolfssl before 3.2.0 has a server certificate that is not properly authorized for server authentication.,7.5,NETWORK,LOW,NONE,NONE,UNCHANGED,NONE,HIGH,NONE
CVE-2014-2906,2020-01-28T16:15Z,2020-02-03T17:01Z,"The psub function in fish (aka fish-shell) 1.16.0 before 2.1.1 does not properly create temporary files, which allows local users to execute arbitrary commands via a temporary file with a predictable name.",7.0,LOCAL,HIGH,LOW,NONE,UNCHANGED,HIGH,HIGH,HIGH
CVE-2014-2914,2020-01-28T16:15Z,2020-02-04T17:09Z,"fish (aka fish-shell) 2.0.0 before 2.1.1 does not restrict access to the configuration service (aka fish_config), which allows remote attackers to execute arbitrary code via unspecified vectors, as demonstrated by set_prompt.",9.8,NETWORK,LOW,NONE,NONE,UNCHANGED,HIGH,HIGH,HIGH
CVE-2014-2960,2017-04-10T03:59Z,2017-04-14T14:46Z,"Vision Critical before 2014-05-30 allows attackers to read arbitrary files via unspecified vectors, as demonstrated by image files and configuration files.",7.5,NETWORK,LOW,NONE,NONE,UNCHANGED,HIGH,NONE,NONE
CVE-2014-3005,2018-02-01T17:29Z,2018-02-21T14:57Z,"XML external entity (XXE) vulnerability in Zabbix 1.8.x before 1.8.21rc1, 2.0.x before 2.0.13rc1, 2.2.x before 2.2.5rc1, and 2.3.x before 2.3.2 allows remote attackers to read arbitrary files or potentially execute arbitrary code via a crafted DTD in an XML request.",9.8,NETWORK,LOW,NONE,NONE,UNCHANGED,HIGH,HIGH,HIGH
CVE-2014-3114,2018-04-10T15:29Z,2018-05-18T13:21Z,The EZPZ One Click Backup (ezpz-one-click-backup) plugin 12.03.10 and earlier for WordPress allows remote attackers to execute arbitrary commands via the cmd parameter to functions/ezpz-archive-cmd.php.,9.8,NETWORK,LOW,NONE,NONE,UNCHANGED,HIGH,HIGH,HIGH
CVE-2014-3119,2020-01-31T21:15Z,2020-02-05T16:29Z,Multiple SQL injection vulnerabilities in web2Project 3.1 and earlier allow remote authenticated users to execute arbitrary SQL commands via the (1) search_string parameter in the contacts module to index.php or allow remote attackers to execute arbitrary SQL commands via the updatekey parameter to (2) do_updatecontact.php or (3) updatecontact.php.,8.8,NETWORK,LOW,LOW,NONE,UNCHANGED,HIGH,HIGH,HIGH
CVE-2014-3136,2019-12-27T21:15Z,2020-01-07T19:40Z,Cross-site request forgery (CSRF) vulnerability in D-Link DWR-113 (Rev. Ax) with firmware before 2.03b02 allows remote attackers to hijack the authentication of administrators for requests that change the admin password via unspecified vectors.,8.8,NETWORK,LOW,NONE,REQUIRED,UNCHANGED,HIGH,HIGH,HIGH
CVE-2014-3150,2017-11-15T18:29Z,2017-12-05T01:01Z,"Livebox 1.1 allows remote authenticated users to upload arbitrary configuration files, download the configuration file, or obtain sensitive information via crafted Javascript.",8.8,NETWORK,LOW,LOW,NONE,UNCHANGED,HIGH,HIGH,HIGH
CVE-2014-3164,2017-10-18T14:29Z,2017-11-07T13:07Z,"cmds/servicemanager/service_manager.c in Android before commit 7d42a3c31ba78a418f9bdde0e0ab951469f321b5 allows attackers to cause a denial of service (NULL pointer dereference, or out-of-bounds write) via vectors related to binder passed lengths.",7.5,NETWORK,LOW,NONE,NONE,UNCHANGED,NONE,NONE,HIGH
CVE-2014-3180,2019-11-06T20:15Z,2019-11-08T20:51Z,"** DISPUTED ** In kernel/compat.c in the Linux kernel before 3.17, as used in Google Chrome OS and other products, there is a possible out-of-bounds read. restart_syscall uses uninitialized data when restarting compat_sys_nanosleep. NOTE: this is disputed because the code path is unreachable.",9.1,NETWORK,LOW,NONE,NONE,UNCHANGED,HIGH,NONE,HIGH
CVE-2014-3205,2018-02-23T17:29Z,2018-03-18T15:13Z,backupmgt/pre_connect_check.php in Seagate BlackArmor NAS contains a hard-coded password of '!~@##$$%FREDESWWSED' for a backdoor user.,9.8,NETWORK,LOW,NONE,NONE,UNCHANGED,HIGH,HIGH,HIGH
CVE-2014-3206,2018-02-23T17:29Z,2018-03-19T15:27Z,Seagate BlackArmor NAS allows remote attackers to execute arbitrary code via the session parameter to localhost/backupmgt/localJob.php or the auth_name parameter to localhost/backupmgmt/pre_connect_check.php.,9.8,NETWORK,LOW,NONE,NONE,UNCHANGED,HIGH,HIGH,HIGH
CVE-2014-3208,2020-02-13T20:15Z,2020-02-19T15:29Z,"A Denial of Service vulnerability exists in askpop3d 0.7.7 in free (pszQuery),",7.5,NETWORK,LOW,NONE,NONE,UNCHANGED,NONE,NONE,HIGH
CVE-2014-3211,2020-01-09T14:15Z,2020-01-13T20:02Z,Publify before 8.0.1 is vulnerable to a Denial of Service attack,7.5,NETWORK,LOW,NONE,NONE,UNCHANGED,NONE,NONE,HIGH
CVE-2014-3219,2018-02-09T22:29Z,2019-09-24T15:15Z,"fish before 2.1.1 allows local users to write to arbitrary files via a symlink attack on (1) /tmp/fishd.log.%s, (2) /tmp/.pac-cache.$USER, (3) /tmp/.yum-cache.$USER, or (4) /tmp/.rpm-cache.$USER.",7.8,LOCAL,LOW,LOW,NONE,UNCHANGED,HIGH,HIGH,HIGH
CVE-2014-3221,2017-04-02T20:59Z,2017-04-05T16:48Z,"Huawei Eudemon8000E firewall with software V200R001C01SPC800 and earlier versions allows users to log in to the device using Telnet or SSH. When an attacker sends to the device a mass of TCP packets with special structure, the logging process becomes slow and users may be unable to log in to the device.",7.5,NETWORK,LOW,NONE,NONE,UNCHANGED,NONE,NONE,HIGH
CVE-2014-3222,2017-04-02T20:59Z,2017-04-04T20:43Z,"In Huawei eSpace Meeting with software V100R001C03SPC201 and the earlier versions, attackers that obtain the permissions assigned to common users can elevate privileges to access and set specific key resources.",7.0,LOCAL,HIGH,LOW,NONE,UNCHANGED,HIGH,HIGH,HIGH
CVE-2014-3223,2017-04-02T20:59Z,2017-04-05T15:06Z,"Huawei S9300 with software before V100R006SPH013 and S2300,S3300,S5300,S6300 with software before V100R006SPH010 support Y.1731 and therefore have the Y.1731 vulnerability in processing special packets. The vulnerability causes the restart of switches.",7.5,NETWORK,LOW,NONE,NONE,UNCHANGED,NONE,NONE,HIGH
CVE-2014-3224,2017-04-02T20:59Z,2017-04-05T15:07Z,"Huawei Quidway S9700 V200R003C00SPC500, Quidway S9300 V200R003C00SPC500, Quidway S7700 V200R003C00SPC500, Quidway S6700 V200R003C00SPC300, Quidway S6300 V200R003C00SPC300, Quidway S5700 V200R003C00SPC300, Quidway S5300 V200R003C00SPC300 enable attackers to launch DoS attacks by crafting and sending malformed packets to these vulnerable products.",7.5,NETWORK,LOW,NONE,NONE,UNCHANGED,NONE,NONE,HIGH
CVE-2014-3230,2020-01-28T16:15Z,2020-02-06T15:23Z,"The libwww-perl LWP::Protocol::https module 6.04 through 6.06 for Perl, when using IO::Socket::SSL as the SSL socket class, allows attackers to disable server certificate validation via the (1) HTTPS_CA_DIR or (2) HTTPS_CA_FILE environment variable.",5.9,NETWORK,HIGH,NONE,NONE,UNCHANGED,NONE,HIGH,NONE
CVE-2014-3244,2018-02-01T17:29Z,2018-02-15T16:23Z,XML external entity (XXE) vulnerability in the RSSDashlet dashlet in SugarCRM before 6.5.17 allows remote attackers to read arbitrary files or potentially execute arbitrary code via a crafted DTD in an XML request.,9.8,NETWORK,LOW,NONE,NONE,UNCHANGED,HIGH,HIGH,HIGH
CVE-2014-3250,2017-12-11T17:29Z,2017-12-27T16:31Z,"The default vhost configuration file in Puppet before 3.6.2 does not include the SSLCARevocationCheck directive, which might allow remote attackers to obtain sensitive information via a revoked certificate when a Puppet master runs with Apache 2.4.",6.5,NETWORK,LOW,LOW,NONE,UNCHANGED,HIGH,NONE,NONE
CVE-2014-3260,2015-12-31T05:59Z,2015-12-31T20:28Z,Pacom 1000 CCU and RTU GMS devices allow remote attackers to spoof the controller-to-base data stream by leveraging improper use of cryptography.,7.5,ADJACENT_NETWORK,HIGH,NONE,NONE,UNCHANGED,HIGH,HIGH,HIGH
CVE-2014-3413,2018-04-05T17:29Z,2018-08-10T14:34Z,"The MySQL server in Juniper Networks Junos Space before 13.3R1.8 has an unspecified account with a hardcoded password, which allows remote attackers to obtain sensitive information and consequently obtain administrative control by leveraging database access.",9.8,NETWORK,LOW,NONE,NONE,UNCHANGED,HIGH,HIGH,HIGH
CVE-2014-3445,2020-01-28T15:15Z,2020-01-31T19:11Z,"backup.php in HandsomeWeb SOS Webpages before 1.1.12 does not require knowledge of the cleartext password, which allows remote attackers to bypass authentication by leveraging knowledge of the administrator password hash.",9.8,NETWORK,LOW,NONE,NONE,UNCHANGED,HIGH,HIGH,HIGH
CVE-2014-3447,2020-01-09T14:15Z,2020-01-14T15:45Z,BSS Continuity CMS 4.2.22640.0 has a Remote Denial Of Service vulnerability,7.5,NETWORK,LOW,NONE,NONE,UNCHANGED,NONE,NONE,HIGH
CVE-2014-3448,2020-01-09T14:15Z,2020-01-14T15:45Z,BSS Continuity CMS 4.2.22640.0 has a Remote Code Execution vulnerability due to unauthenticated file upload,9.8,NETWORK,LOW,NONE,NONE,UNCHANGED,HIGH,HIGH,HIGH
CVE-2014-3449,2020-01-09T14:15Z,2020-01-14T15:47Z,BSS Continuity CMS 4.2.22640.0 has an Authentication Bypass vulnerability,9.8,NETWORK,LOW,NONE,NONE,UNCHANGED,HIGH,HIGH,HIGH
CVE-2014-3451,2017-08-18T18:29Z,2018-10-09T19:43Z,"OpenFire XMPP Server before 3.10 accepts self-signed certificates, which allows remote attackers to perform unspecified spoofing attacks.",7.5,NETWORK,LOW,NONE,NONE,UNCHANGED,NONE,HIGH,NONE
CVE-2014-3462,2017-08-07T20:29Z,2020-08-21T18:24Z,"The "".encfs6.xml"" configuration file in encfs before 1.7.5 allows remote attackers to access sensitive data by setting ""blockMACBytes"" to 0 and adding 8 to ""blockMACRandBytes"".",7.5,NETWORK,LOW,NONE,NONE,UNCHANGED,HIGH,NONE,NONE
CVE-2014-3471,2018-01-12T17:29Z,2018-01-31T14:51Z,Use-after-free vulnerability in hw/pci/pcie.c in QEMU (aka Quick Emulator) allows local guest OS users to cause a denial of service (QEMU instance crash) via hotplug and hotunplug operations of Virtio block devices.,5.5,LOCAL,LOW,LOW,NONE,UNCHANGED,NONE,NONE,HIGH
CVE-2014-3484,2020-02-20T04:15Z,2020-02-28T21:14Z,"Multiple stack-based buffer overflows in the __dn_expand function in network/dn_expand.c in musl libc 1.1x before 1.1.2 and 0.9.13 through 1.0.3 allow remote attackers to (1) have unspecified impact via an invalid name length in a DNS response or (2) cause a denial of service (crash) via an invalid name length in a DNS response, related to an infinite loop with no output.",9.8,NETWORK,LOW,NONE,NONE,UNCHANGED,HIGH,HIGH,HIGH
CVE-2014-3495,2019-12-13T14:15Z,2019-12-19T18:16Z,duplicity 0.6.24 has improper verification of SSL certificates,7.5,NETWORK,LOW,NONE,NONE,UNCHANGED,HIGH,NONE,NONE
CVE-2014-3498,2017-06-08T18:29Z,2018-10-30T16:28Z,The user module in ansible before 1.6.6 allows remote authenticated users to execute arbitrary commands.,8.8,NETWORK,LOW,LOW,NONE,UNCHANGED,HIGH,HIGH,HIGH
CVE-2014-3519,2018-02-01T17:29Z,2018-02-27T18:37Z,"The open_by_handle_at function in vzkernel before 042stab090.5 in the OpenVZ modification for the Linux kernel 2.6.32, when using simfs, might allow local container users with CAP_DAC_READ_SEARCH capability to bypass an intended container protection mechanism and access arbitrary files on a filesystem via vectors related to use of the file_handle structure.",6.5,LOCAL,LOW,LOW,NONE,CHANGED,HIGH,NONE,NONE
CVE-2014-3526,2017-10-30T14:29Z,2019-12-11T22:12Z,"Apache Wicket before 1.5.12, 6.x before 6.17.0, and 7.x before 7.0.0-M3 might allow remote attackers to obtain sensitive information via vectors involving identifiers for storing page markup for temporary user sessions.",7.5,NETWORK,LOW,NONE,NONE,UNCHANGED,HIGH,NONE,NONE
