CVE_ID,PublishTime,ModifyTime,Report,CVSSV3,AttackVector,AttackComplexity,PrivilegesRequired,UserInteraction,Scope,ConfidentialityImpact,IntegrityImpact,AvailabilityImpact
CVE-2014-9487,2017-10-17T14:29Z,2017-11-08T17:09Z,"The getid3 library in MediaWiki before 1.24.1, 1.23.8, 1.22.15 and 1.19.23 allows remote attackers to read arbitrary files, cause a denial of service, or possibly have other impact via an XML External Entity (XXE) attack.  NOTE: Related to CVE-2014-2053.",9.8,NETWORK,LOW,NONE,NONE,UNCHANGED,HIGH,HIGH,HIGH
CVE-2014-9489,2017-10-17T14:29Z,2017-11-08T16:20Z,"The gollum-grit_adapter Ruby gem dependency in gollum before 3.1.1 and the gollum-lib gem dependency in gollum-lib before 4.0.1 when the string ""master"" is in any of the wiki documents, allows remote authenticated users to execute arbitrary code via the -O or --open-files-in-pager flags.",8.8,NETWORK,LOW,LOW,NONE,UNCHANGED,HIGH,HIGH,HIGH
CVE-2014-9497,2017-08-29T20:29Z,2017-09-03T13:16Z,Buffer overflow in mpg123 before 1.18.0.,7.5,NETWORK,LOW,NONE,NONE,UNCHANGED,NONE,NONE,HIGH
CVE-2014-9502,2018-02-01T17:29Z,2018-02-27T18:55Z,Multiple cross-site request forgery (CSRF) vulnerabilities in unspecified sub modules in the Open Atrium module 7.x-2.x before 7.x-2.26 for Drupal allow remote attackers to hijack the authentication of unknown victims via vectors related to menu callbacks.,8.8,NETWORK,LOW,NONE,REQUIRED,UNCHANGED,HIGH,HIGH,HIGH
CVE-2014-9503,2018-02-01T17:29Z,2018-02-27T18:58Z,"The Discussions sub module in the Open Atrium module 7.x-2.x before 7.x-2.26 for Drupal allows remote authenticated users with ""access content"" permissions to modify arbitrary nodes by leveraging improper access checks on unspecified ajax callbacks.",6.5,NETWORK,LOW,LOW,NONE,UNCHANGED,NONE,HIGH,NONE
CVE-2014-9504,2018-02-01T17:29Z,2018-02-27T18:45Z,"The OG Subgroups module, when used with the Open Atrium module 7.x-2.x before 7.x-2.26 for Drupal, allows remote attackers to access child groups via vectors related to membership inheritance.",7.5,NETWORK,LOW,NONE,NONE,UNCHANGED,NONE,HIGH,NONE
CVE-2014-9513,2017-08-28T15:29Z,2017-09-08T02:22Z,Insecure use of temporary files in xbindkeys-config 0.1.3-2 allows remote attackers to execute arbitrary code.,9.8,NETWORK,LOW,NONE,NONE,UNCHANGED,HIGH,HIGH,HIGH
CVE-2014-9514,2017-08-28T15:29Z,2017-08-31T13:46Z,Cross-site scripting (XSS) vulnerability in BMC Footprints Service Core 11.5.,6.1,NETWORK,LOW,NONE,REQUIRED,CHANGED,LOW,LOW,NONE
CVE-2014-9515,2017-12-29T22:29Z,2021-06-14T18:15Z,"Dozer improperly uses a reflection-based approach to type conversion, which might allow remote attackers to execute arbitrary code via a crafted serialized object.",9.8,NETWORK,LOW,NONE,NONE,UNCHANGED,HIGH,HIGH,HIGH
CVE-2014-9530,2020-02-07T15:15Z,2020-02-10T15:12Z,"A vulnerability exists in nw.js before 0.11.3 when calling nw methods from normal frames, which has an unspecified impact.",9.8,NETWORK,LOW,NONE,NONE,UNCHANGED,HIGH,HIGH,HIGH
CVE-2014-9557,2017-08-28T15:29Z,2020-10-02T14:56Z,Multiple cross-site scripting (XSS) vulnerabilities in SmartCMS v.2.,6.1,NETWORK,LOW,NONE,REQUIRED,CHANGED,LOW,LOW,NONE
CVE-2014-9558,2017-08-28T15:29Z,2017-08-31T15:52Z,Multiple SQL injection vulnerabilities in SmartCMS v.2.,9.8,NETWORK,LOW,NONE,NONE,UNCHANGED,HIGH,HIGH,HIGH
CVE-2014-9563,2018-04-12T21:29Z,2021-09-09T17:12Z,CRLF injection vulnerability in the web-based management (WBM) interface in Unify (former Siemens) OpenStage SIP and OpenScape Desk Phone IP V3 devices before R3.32.0 allows remote authenticated users to modify the root password and consequently access the debug port using the serial interface via the ssh-password parameter to page.cmd.,4.9,NETWORK,LOW,HIGH,NONE,UNCHANGED,NONE,HIGH,NONE
CVE-2014-9564,2017-08-25T18:29Z,2017-08-30T13:49Z,"CRLF injection vulnerability in IBM Flex System EN6131 40Gb Ethernet and IB6131 40Gb Infiniband Switch firmware before 3.4.1110 allows remote attackers to inject arbitrary HTTP headers and conduct HTTP response splitting attacks and resulting web cache poisoning or cross-site scripting (XSS) attacks, or obtain sensitive information via multiple unspecified parameters.",6.1,NETWORK,LOW,NONE,REQUIRED,CHANGED,LOW,LOW,NONE
CVE-2014-9565,2017-09-07T20:29Z,2017-09-12T15:28Z,Cross-site request forgery (CSRF) vulnerability in IBM Flex System EN6131 40Gb Ethernet and IB6131 40Gb Infiniband Switch firmware 3.4.0000 and earlier.,8.8,NETWORK,LOW,NONE,REQUIRED,UNCHANGED,HIGH,HIGH,HIGH
CVE-2014-9606,2020-02-19T20:15Z,2020-02-20T16:30Z,"Multiple cross-site scripting (XSS) vulnerabilities in Netsweeper before 3.1.10, 4.0.x before 4.0.9, and 4.1.x before 4.1.2 allow remote attackers to inject arbitrary web script or HTML via the (1) server parameter to remotereporter/load_logfiles.php, (2) customctid parameter to webadmin/policy/category_table_ajax.php, (3) urllist parameter to webadmin/alert/alert.php, (4) QUERY_STRING to webadmin/ajaxfilemanager/ajax_get_file_listing.php, or (5) PATH_INFO to webadmin/policy/policy_table_ajax.php/.",6.1,NETWORK,LOW,NONE,REQUIRED,CHANGED,LOW,LOW,NONE
CVE-2014-9607,2020-02-19T20:15Z,2020-02-20T17:00Z,Cross-site scripting (XSS) vulnerability in remotereporter/load_logfiles.php in Netsweeper 4.0.3 and 4.0.4 allows remote attackers to inject arbitrary web script or HTML via the url parameter.,6.1,NETWORK,LOW,NONE,REQUIRED,CHANGED,LOW,LOW,NONE
CVE-2014-9608,2020-02-19T20:15Z,2020-02-20T15:11Z,"Cross-site scripting (XSS) vulnerability in webadmin/policy/group_table_ajax.php/ in Netsweeper before 3.1.10, 4.0.x before 4.0.9, and 4.1.x before 4.1.2 allows remote attackers to inject arbitrary web script or HTML via the PATH_INFO.",6.1,NETWORK,LOW,NONE,REQUIRED,CHANGED,LOW,LOW,NONE
CVE-2014-9609,2020-02-19T20:15Z,2020-02-20T16:26Z,"Directory traversal vulnerability in webadmin/reporter/view_server_log.php in Netsweeper before 3.1.10, 4.0.x before 4.0.9, and 4.1.x before 4.1.2 allows remote attackers to list directory contents via a .. (dot dot) in the log parameter in a stats action.",5.3,NETWORK,LOW,NONE,NONE,UNCHANGED,LOW,NONE,NONE
CVE-2014-9610,2017-09-19T15:29Z,2017-09-27T19:49Z,"Netsweeper before 3.1.10, 4.0.x before 4.0.9, and 4.1.x before 4.1.2 allows remote attackers to bypass authentication and remove IP addresses from the quarantine via the ip parameter to webadmin/user/quarantine_disable.php.",5.3,NETWORK,LOW,NONE,NONE,UNCHANGED,NONE,LOW,NONE
CVE-2014-9611,2017-09-19T15:29Z,2017-09-27T20:00Z,Netsweeper before 4.0.5 allows remote attackers to bypass authentication and create arbitrary accounts and policies via a request to webadmin/nslam/index.php.,9.8,NETWORK,LOW,NONE,NONE,UNCHANGED,HIGH,HIGH,HIGH
CVE-2014-9612,2020-02-19T20:15Z,2020-02-20T16:17Z,"SQL injection vulnerability in remotereporter/load_logfiles.php in Netsweeper before 3.1.10, 4.0.x before 4.0.9, and 4.1.x before 4.1.2 allows remote attackers to execute arbitrary SQL commands via the server parameter.",9.8,NETWORK,LOW,NONE,NONE,UNCHANGED,HIGH,HIGH,HIGH
CVE-2014-9613,2020-02-19T20:15Z,2020-02-20T17:23Z,Multiple SQL injection vulnerabilities in Netsweeper before 2.6.29.10 allow remote attackers to execute arbitrary SQL commands via the (1) login parameter to webadmin/auth/verification.php or (2) dpid parameter to webadmin/deny/index.php.,9.8,NETWORK,LOW,NONE,NONE,UNCHANGED,HIGH,HIGH,HIGH
CVE-2014-9614,2020-02-19T20:15Z,2020-02-20T19:07Z,"The Web Panel in Netsweeper before 4.0.5 has a default password of branding for the branding account, which makes it easier for remote attackers to obtain access via a request to webadmin/.",9.8,NETWORK,LOW,NONE,NONE,UNCHANGED,HIGH,HIGH,HIGH
CVE-2014-9615,2020-02-19T20:15Z,2020-02-20T17:03Z,Cross-site scripting (XSS) vulnerability in Netsweeper 4.0.4 allows remote attackers to inject arbitrary web script or HTML via the url parameter to webadmin/deny/index.php.,6.1,NETWORK,LOW,NONE,REQUIRED,CHANGED,LOW,LOW,NONE
CVE-2014-9616,2017-09-19T15:29Z,2017-09-27T19:49Z,"Netsweeper before 3.1.10, 4.0.x before 4.0.9, and 4.1.x before 4.1.2 allows remote attackers to obtain sensitive information by making a request that redirects to the deny page.",7.5,NETWORK,LOW,NONE,NONE,UNCHANGED,HIGH,NONE,NONE
CVE-2014-9617,2020-02-19T21:15Z,2020-02-20T17:09Z,Open redirect vulnerability in remotereporter/load_logfiles.php in Netsweeper before 4.0.5 allows remote attackers to redirect users to arbitrary web sites and conduct phishing attacks via a URL in the url parameter.,6.1,NETWORK,LOW,NONE,REQUIRED,CHANGED,LOW,LOW,NONE
CVE-2014-9618,2017-09-19T15:29Z,2017-09-29T13:47Z,"The Client Filter Admin portal in Netsweeper before 3.1.10, 4.0.x before 4.0.9, and 4.1.x before 4.1.2 allows remote attackers to bypass authentication and subsequently create arbitrary profiles via a showdeny action to the default URL.",9.8,NETWORK,LOW,NONE,NONE,UNCHANGED,HIGH,HIGH,HIGH
CVE-2014-9619,2017-09-19T15:29Z,2017-09-27T19:48Z,"Unrestricted file upload vulnerability in webadmin/ajaxfilemanager/ajaxfilemanager.php in Netsweeper before 3.1.10, 4.0.x before 4.0.9, and 4.1.x before 4.1.2 allows remote authenticated users with admin privileges on the Cloud Manager web console to execute arbitrary PHP code by uploading a file with a double extension, then accessing it via a direct request to the file in webadmin/deny/images/, as demonstrated by secuid0.php.gif.",7.2,NETWORK,LOW,HIGH,NONE,UNCHANGED,HIGH,HIGH,HIGH
CVE-2014-9624,2017-09-12T14:29Z,2017-09-20T18:11Z,CAPTCHA bypass vulnerability in MantisBT before 1.2.19.,7.5,NETWORK,LOW,NONE,NONE,UNCHANGED,NONE,HIGH,NONE
CVE-2014-9625,2020-01-24T22:15Z,2020-01-29T16:46Z,"The GetUpdateFile function in misc/update.c in the Updater in VideoLAN VLC media player before 2.1.6 performs an incorrect cast operation from a 64-bit integer to a 32-bit integer, which allows remote attackers to conduct buffer overflow attacks and execute arbitrary code via a crafted update status file, aka an ""integer truncation"" vulnerability.",7.8,LOCAL,LOW,NONE,REQUIRED,UNCHANGED,HIGH,HIGH,HIGH
CVE-2014-9626,2020-01-24T22:15Z,2020-01-29T20:02Z,Integer underflow in the MP4_ReadBox_String function in modules/demux/mp4/libmp4.c in VideoLAN VLC media player before 2.1.6 allows remote attackers to cause a denial of service or possibly have unspecified other impact via a box size less than 7.,7.8,LOCAL,LOW,NONE,REQUIRED,UNCHANGED,HIGH,HIGH,HIGH
CVE-2014-9627,2020-01-24T22:15Z,2020-01-29T20:24Z,"The MP4_ReadBox_String function in modules/demux/mp4/libmp4.c in VideoLAN VLC media player before 2.1.6 performs an incorrect cast operation from a 64-bit integer to a 32-bit integer, which allows remote attackers to cause a denial of service or possibly have unspecified other impact via a large box size.",7.8,LOCAL,LOW,NONE,REQUIRED,UNCHANGED,HIGH,HIGH,HIGH
CVE-2014-9628,2020-01-24T22:15Z,2020-01-29T18:09Z,"The MP4_ReadBox_String function in modules/demux/mp4/libmp4.c in VideoLAN VLC media player before 2.1.6 allows remote attackers to trigger an unintended zero-size malloc and conduct buffer overflow attacks, and consequently execute arbitrary code, via a box size of 7.",7.8,LOCAL,LOW,NONE,REQUIRED,UNCHANGED,HIGH,HIGH,HIGH
CVE-2014-9629,2020-01-24T22:15Z,2020-01-29T16:43Z,Integer overflow in the Encode function in modules/codec/schroedinger.c in VideoLAN VLC media player before 2.1.6 and 2.2.x before 2.2.1 allows remote attackers to conduct buffer overflow attacks and execute arbitrary code via a crafted length value.,7.8,LOCAL,LOW,NONE,REQUIRED,UNCHANGED,HIGH,HIGH,HIGH
CVE-2014-9630,2020-01-24T22:15Z,2020-01-29T16:17Z,"The rtp_packetize_xiph_config function in modules/stream_out/rtpfmt.c in VideoLAN VLC media player before 2.1.6 uses a stack-allocation approach with a size determined by arbitrary input data, which allows remote attackers to cause a denial of service (memory corruption) or possibly have unspecified other impact via a crafted length value.",7.8,LOCAL,LOW,NONE,REQUIRED,UNCHANGED,HIGH,HIGH,HIGH
CVE-2014-9634,2017-09-12T14:29Z,2017-09-21T18:47Z,"Jenkins before 1.586 does not set the secure flag on session cookies when run on Tomcat 7.0.41 or later, which makes it easier for remote attackers to capture cookies by intercepting their transmission within an HTTP session.",5.3,NETWORK,LOW,NONE,NONE,UNCHANGED,LOW,NONE,NONE
CVE-2014-9635,2017-09-12T14:29Z,2017-09-21T18:47Z,"Jenkins before 1.586 does not set the HttpOnly flag in a Set-Cookie header for session cookies when run on Tomcat 7.0.41 or later, which makes it easier for remote attackers to obtain potentially sensitive information via script access to cookies.",5.3,NETWORK,LOW,NONE,NONE,UNCHANGED,LOW,NONE,NONE
CVE-2014-9637,2017-08-25T18:29Z,2017-08-30T01:16Z,GNU patch 2.7.2 and earlier allows remote attackers to cause a denial of service (memory consumption and segmentation fault) via a crafted diff file.,5.5,LOCAL,LOW,NONE,REQUIRED,UNCHANGED,NONE,NONE,HIGH
CVE-2014-9645,2017-03-12T06:59Z,2019-04-03T15:29Z,"The add_probe function in modutils/modprobe.c in BusyBox before 1.23.0 allows local users to bypass intended restrictions on loading kernel modules via a / (slash) character in a module name, as demonstrated by an ""ifconfig /usbserial up"" command or a ""mount -t /snd_pcm none /"" command.",5.5,LOCAL,LOW,LOW,NONE,UNCHANGED,NONE,HIGH,NONE
CVE-2014-9654,2017-04-24T06:59Z,2019-04-23T19:29Z,"The Regular Expressions package in International Components for Unicode (ICU) for C/C++ before 2014-12-03, as used in Google Chrome before 40.0.2214.91, calculates certain values without ensuring that they can be represented in a 24-bit field, which allows remote attackers to cause a denial of service (memory corruption) or possibly have unspecified other impact via a crafted string, a related issue to CVE-2014-7923.",9.8,NETWORK,LOW,NONE,NONE,UNCHANGED,HIGH,HIGH,HIGH
CVE-2014-9655,2016-04-13T17:59Z,2018-01-05T02:29Z,"The (1) putcontig8bitYCbCr21tile function in tif_getimage.c or (2) NeXTDecode function in tif_next.c in LibTIFF allows remote attackers to cause a denial of service (uninitialized memory access) via a crafted TIFF image, as demonstrated by libtiff-cvs-1.tif and libtiff-cvs-2.tif.",6.5,NETWORK,LOW,NONE,REQUIRED,UNCHANGED,NONE,NONE,HIGH
CVE-2014-9677,2017-10-17T14:29Z,2017-10-27T14:53Z,Cross-site scripting (XSS) vulnerability in FlexPaperViewer.swf in Flexpaper before 2.3.1 allows remote attackers to inject arbitrary web script or HTML via the Swfile parameter.,6.1,NETWORK,LOW,NONE,REQUIRED,CHANGED,LOW,LOW,NONE
CVE-2014-9678,2017-10-17T14:29Z,2017-11-08T18:04Z,FlexPaperViewer.swf in Flexpaper before 2.3.1 allows remote attackers to conduct content-spoofing attacks via the Swfile parameter.,6.1,NETWORK,LOW,NONE,REQUIRED,CHANGED,LOW,LOW,NONE
CVE-2014-9680,2017-04-24T06:59Z,2018-01-05T02:29Z,"sudo before 1.8.12 does not ensure that the TZ environment variable is associated with a zoneinfo file, which allows local users to open arbitrary files for read access (but not view file contents) by running a program within an sudo session, as demonstrated by interfering with terminal output, discarding kernel-log messages, or repositioning tape drives.",3.3,LOCAL,LOW,LOW,NONE,UNCHANGED,LOW,NONE,NONE
CVE-2014-9686,2017-09-28T01:29Z,2017-10-06T18:03Z,The Googlemaps plugin 3.2 and earlier for Joomla! allows remote attackers with control of a sub-domain belonging to a victim domain to cause a denial of service via the 'url' parameter to plugin_googlemap3_kmlprxy.php.  NOTE: this vulnerability exists because of an incomplete fix for CVE-2013-7428.,5.9,NETWORK,HIGH,NONE,NONE,UNCHANGED,NONE,NONE,HIGH
CVE-2014-9690,2017-04-02T20:59Z,2017-04-05T18:32Z,"Huawei home gateways WS318 with software V100R001C01B022 and earlier versions are affected by the PIN offline brute force cracking vulnerability of the WPS protocol because the random number generator (RNG) used in the supplier's solution is not random enough. As a result, brute force cracking the PIN code is easier. After an attacker cracks the PIN, the attacker can access the Internet via the cracked device.",7.5,NETWORK,LOW,NONE,NONE,UNCHANGED,HIGH,NONE,NONE
CVE-2014-9691,2017-04-02T20:59Z,2017-04-05T23:59Z,"Huawei Tecal RH1288 V2 V100R002C00SPC107 and earlier versions, Tecal RH2265 V2 V100R002C00, Tecal RH2285 V2 V100R002C00SPC115 and earlier versions, Tecal RH2265 V2 V100R002C00, Tecal RH2285H V2 V100R002C00SPC111 and earlier versions, Tecal RH2268 V2 V100R002C00, Tecal RH2288 V2 V100R002C00SPC117 and earlier versions, Tecal RH2288H V2 V100R002C00SPC115 and earlier versions, Tecal RH2485 V2 V100R002C00SPC502 and earlier versions, Tecal RH5885 V2 V100R001C02SPC109 and earlier versions, Tecal RH5885 V3 V100R003C01SPC102 and earlier versions, Tecal RH5885H V3 V100R003C00SPC102 and earlier versions, Tecal XH310 V2 V100R001C00SPC110 and earlier versions, Tecal XH311 V2 V100R001C00SPC110 and earlier versions, Tecal XH320 V2 V100R001C00SPC110 and earlier versions, Tecal XH621 V2 V100R001C00SPC106 and earlier versions, Tecal DH310 V2 V100R001C00SPC110 and earlier versions, Tecal DH320 V2 V100R001C00SPC106 and earlier versions, Tecal DH620 V2 V100R001C00SPC106 and earlier versions, Tecal DH621 V2 V100R001C00SPC107 and earlier versions, Tecal DH628 V2 V100R001C00SPC107 and earlier versions, Tecal BH620 V2 V100R002C00SPC107 and earlier versions, Tecal BH621 V2 V100R002C00SPC106 and earlier versions, Tecal BH622 V2 V100R002C00SPC110 and earlier versions, Tecal BH640 V2 V100R002C00SPC108 and earlier versions, Tecal CH121 V100R001C00SPC180 and earlier versions, Tecal CH140 V100R001C00SPC110 and earlier versions, Tecal CH220 V100R001C00SPC180 and earlier versions, Tecal CH221 V100R001C00SPC180 and earlier versions, Tecal CH222 V100R002C00SPC180 and earlier versions, Tecal CH240 V100R001C00SPC180 and earlier versions, Tecal CH242 V100R001C00SPC180 and earlier versions, Tecal CH242 V3 V100R001C00SPC110 and earlier versions could allow users who log in to the products to view the sessions IDs of all online users on the Online Users page of the web UI.",6.5,NETWORK,LOW,LOW,NONE,UNCHANGED,HIGH,NONE,NONE
CVE-2014-9692,2017-04-02T20:59Z,2017-04-05T23:53Z,"Huawei Tecal RH1288 V2 V100R002C00SPC107 and earlier versions, Tecal RH2265 V2 V100R002C00, Tecal RH2285 V2 V100R002C00SPC115 and earlier versions, Tecal RH2265 V2 V100R002C00, Tecal RH2285H V2 V100R002C00SPC111 and earlier versions, Tecal RH2268 V2 V100R002C00, Tecal RH2288 V2 V100R002C00SPC117 and earlier versions, Tecal RH2288H V2 V100R002C00SPC115 and earlier versions, Tecal RH2485 V2 V100R002C00SPC502 and earlier versions, Tecal RH5885 V2 V100R001C02SPC109 and earlier versions, Tecal RH5885 V3 V100R003C01SPC102 and earlier versions, Tecal RH5885H V3 V100R003C00SPC102 and earlier versions, Tecal XH310 V2 V100R001C00SPC110 and earlier versions, Tecal XH311 V2 V100R001C00SPC110 and earlier versions, Tecal XH320 V2 V100R001C00SPC110 and earlier versions, Tecal XH621 V2 V100R001C00SPC106 and earlier versions, Tecal DH310 V2 V100R001C00SPC110 and earlier versions, Tecal DH320 V2 V100R001C00SPC106 and earlier versions, Tecal DH620 V2 V100R001C00SPC106 and earlier versions, Tecal DH621 V2 V100R001C00SPC107 and earlier versions, Tecal DH628 V2 V100R001C00SPC107 and earlier versions, Tecal BH620 V2 V100R002C00SPC107 and earlier versions, Tecal BH621 V2 V100R002C00SPC106 and earlier versions, Tecal BH622 V2 V100R002C00SPC110 and earlier versions, Tecal BH640 V2 V100R002C00SPC108 and earlier versions, Tecal CH121 V100R001C00SPC180 and earlier versions, Tecal CH140 V100R001C00SPC110 and earlier versions, Tecal CH220 V100R001C00SPC180 and earlier versions, Tecal CH221 V100R001C00SPC180 and earlier versions, Tecal CH222 V100R002C00SPC180 and earlier versions, Tecal CH240 V100R001C00SPC180 and earlier versions, Tecal CH242 V100R001C00SPC180 and earlier versions, Tecal CH242 V3 V100R001C00SPC110 and earlier versions could allow attackers to figure out the RMCP+ session IDs of users and access the system with forged identities.",7.5,NETWORK,LOW,NONE,NONE,UNCHANGED,HIGH,NONE,NONE
CVE-2014-9693,2017-04-02T20:59Z,2017-04-05T23:54Z,"Huawei Tecal RH1288 V2 V100R002C00SPC107 and earlier versions, Tecal RH2265 V2 V100R002C00, Tecal RH2285 V2 V100R002C00SPC115 and earlier versions, Tecal RH2265 V2 V100R002C00, Tecal RH2285H V2 V100R002C00SPC111 and earlier versions, Tecal RH2268 V2 V100R002C00, Tecal RH2288 V2 V100R002C00SPC117 and earlier versions, Tecal RH2288H V2 V100R002C00SPC115 and earlier versions, Tecal RH2485 V2 V100R002C00SPC502 and earlier versions, Tecal RH5885 V2 V100R001C02SPC109 and earlier versions, Tecal RH5885 V3 V100R003C01SPC102 and earlier versions, Tecal RH5885H V3 V100R003C00SPC102 and earlier versions, Tecal XH310 V2 V100R001C00SPC110 and earlier versions, Tecal XH311 V2 V100R001C00SPC110 and earlier versions, Tecal XH320 V2 V100R001C00SPC110 and earlier versions, Tecal XH621 V2 V100R001C00SPC106 and earlier versions, Tecal DH310 V2 V100R001C00SPC110 and earlier versions, Tecal DH320 V2 V100R001C00SPC106 and earlier versions, Tecal DH620 V2 V100R001C00SPC106 and earlier versions, Tecal DH621 V2 V100R001C00SPC107 and earlier versions, Tecal DH628 V2 V100R001C00SPC107 and earlier versions, Tecal BH620 V2 V100R002C00SPC107 and earlier versions, Tecal BH621 V2 V100R002C00SPC106 and earlier versions, Tecal BH622 V2 V100R002C00SPC110 and earlier versions, Tecal BH640 V2 V100R002C00SPC108 and earlier versions, Tecal CH121 V100R001C00SPC180 and earlier versions, Tecal CH140 V100R001C00SPC110 and earlier versions, Tecal CH220 V100R001C00SPC180 and earlier versions, Tecal CH221 V100R001C00SPC180 and earlier versions, Tecal CH222 V100R002C00SPC180 and earlier versions, Tecal CH240 V100R001C00SPC180 and earlier versions, Tecal CH242 V100R001C00SPC180 and earlier versions, Tecal CH242 V3 V100R001C00SPC110 and earlier versions could allow attackers to execute arbitrary code or restart the system via crafted DNS packets.",9.8,NETWORK,LOW,NONE,NONE,UNCHANGED,HIGH,HIGH,HIGH
CVE-2014-9694,2017-04-02T20:59Z,2017-04-05T23:55Z,"Huawei Tecal RH1288 V2 V100R002C00SPC107 and earlier versions, Tecal RH2265 V2 V100R002C00, Tecal RH2285 V2 V100R002C00SPC115 and earlier versions, Tecal RH2265 V2 V100R002C00, Tecal RH2285H V2 V100R002C00SPC111 and earlier versions, Tecal RH2268 V2 V100R002C00, Tecal RH2288 V2 V100R002C00SPC117 and earlier versions, Tecal RH2288H V2 V100R002C00SPC115 and earlier versions, Tecal RH2485 V2 V100R002C00SPC502 and earlier versions, Tecal RH5885 V2 V100R001C02SPC109 and earlier versions, Tecal RH5885 V3 V100R003C01SPC102 and earlier versions, Tecal RH5885H V3 V100R003C00SPC102 and earlier versions, Tecal XH310 V2 V100R001C00SPC110 and earlier versions, Tecal XH311 V2 V100R001C00SPC110 and earlier versions, Tecal XH320 V2 V100R001C00SPC110 and earlier versions, Tecal XH621 V2 V100R001C00SPC106 and earlier versions, Tecal DH310 V2 V100R001C00SPC110 and earlier versions, Tecal DH320 V2 V100R001C00SPC106 and earlier versions, Tecal DH620 V2 V100R001C00SPC106 and earlier versions, Tecal DH621 V2 V100R001C00SPC107 and earlier versions, Tecal DH628 V2 V100R001C00SPC107 and earlier versions, Tecal BH620 V2 V100R002C00SPC107 and earlier versions, Tecal BH621 V2 V100R002C00SPC106 and earlier versions, Tecal BH622 V2 V100R002C00SPC110 and earlier versions, Tecal BH640 V2 V100R002C00SPC108 and earlier versions, Tecal CH121 V100R001C00SPC180 and earlier versions, Tecal CH140 V100R001C00SPC110 and earlier versions, Tecal CH220 V100R001C00SPC180 and earlier versions, Tecal CH221 V100R001C00SPC180 and earlier versions, Tecal CH222 V100R002C00SPC180 and earlier versions, Tecal CH240 V100R001C00SPC180 and earlier versions, Tecal CH242 V100R001C00SPC180 and earlier versions, Tecal CH242 V3 V100R001C00SPC110 and earlier versions have a CSRF vulnerability. The products do not use the Token mechanism for web access control. When users log in to the Huawei servers and access websites containing the malicious CSRF script, the CSRF script is executed, which may cause configuration tampering and system restart.",8.8,NETWORK,LOW,NONE,REQUIRED,UNCHANGED,HIGH,HIGH,HIGH
CVE-2014-9695,2017-04-02T20:59Z,2017-04-05T18:45Z,The Hyper Module Management (HMM) software of Huawei Tecal E9000 Chassis V100R001C00SPC160 and earlier versions could allow a non-super-domain user who accesses HMM through SNMPv3 to perform operations on a server as a super-domain user.,8.8,NETWORK,LOW,LOW,NONE,UNCHANGED,HIGH,HIGH,HIGH
CVE-2014-9696,2017-04-02T20:59Z,2017-04-05T18:45Z,The Hyper Module Management (HMM) software of Huawei Tecal E9000 Chassis V100R001C00SPC160 and earlier versions allows the operator to modify the user configuration of iMana through privilege escalation.,8.8,NETWORK,LOW,LOW,NONE,UNCHANGED,HIGH,HIGH,HIGH
CVE-2014-9697,2017-10-17T14:29Z,2017-11-08T18:05Z,"Huawei USG9560/9520/9580 before V300R001C01SPC300 allows remote attackers to cause a memory leak or denial of service (memory exhaustion, reboot and MPU switchover) via a crafted website.",7.5,NETWORK,LOW,NONE,NONE,UNCHANGED,NONE,NONE,HIGH
CVE-2014-9699,2019-06-24T21:15Z,2019-07-03T13:59Z,"The MakerBot Replicator 5G printer runs an Apache HTTP Server with directory indexing enabled. Apache logs, system logs, design files (i.e., a history of print files), and more are exposed to unauthenticated attackers through this HTTP server.",7.5,NETWORK,LOW,NONE,NONE,UNCHANGED,HIGH,NONE,NONE
CVE-2014-9701,2017-08-09T18:29Z,2017-08-17T17:49Z,Cross-site scripting (XSS) vulnerability in MantisBT before 1.2.19 and 1.3.x before 1.3.0-beta.2 allows remote attackers to inject arbitrary web script or HTML via the url parameter to permalink_page.php.,6.5,NETWORK,LOW,NONE,NONE,UNCHANGED,LOW,LOW,NONE
CVE-2014-9702,2020-06-01T17:15Z,2020-06-04T16:10Z,"system/classes/DbPDO.php in Cmfive through 2015-03-15, when database connectivity malfunctions, allows remote attackers to obtain sensitive information (username and password) via any request, such as a password reset request.",7.5,NETWORK,LOW,NONE,NONE,UNCHANGED,HIGH,NONE,NONE
