CVE_ID,PublishTime,ModifyTime,Report,CVSSV3,AttackVector,AttackComplexity,PrivilegesRequired,UserInteraction,Scope,ConfidentialityImpact,IntegrityImpact,AvailabilityImpact
CVE-2014-5001,2018-01-10T18:29Z,2018-01-30T19:02Z,"lib/ksymfony1.rb in the kcapifony gem 2.1.6 for Ruby places database user passwords on the (1) mysqldump, (2) pg_dump, (3) mysql, and (4) psql command lines, which allows local users to obtain sensitive information by listing the processes.",7.8,LOCAL,LOW,LOW,NONE,UNCHANGED,HIGH,HIGH,HIGH
CVE-2014-5002,2018-01-10T18:29Z,2019-05-06T14:24Z,"The lynx gem before 1.0.0 for Ruby places the configured password on command lines, which allows local users to obtain sensitive information by listing processes.",7.8,LOCAL,LOW,LOW,NONE,UNCHANGED,HIGH,HIGH,HIGH
CVE-2014-5003,2018-01-10T18:29Z,2018-01-30T19:13Z,chef/travis-cookbooks/ci_environment/perlbrew/recipes/default.rb in the ciborg gem 3.0.0 for Ruby allows local users to write to arbitrary files and gain privileges via a symlink attack on /tmp/perlbrew-installer.,5.5,LOCAL,LOW,LOW,NONE,UNCHANGED,NONE,HIGH,NONE
CVE-2014-5004,2018-01-10T18:29Z,2018-01-30T19:15Z,"lib/brbackup.rb in the brbackup gem 0.1.1 for Ruby places the database password on the mysql command line, which allows local users to obtain sensitive information by listing the process.",7.8,LOCAL,LOW,LOW,NONE,UNCHANGED,HIGH,HIGH,HIGH
CVE-2014-5007,2020-01-17T22:15Z,2020-01-29T15:20Z,Directory traversal vulnerability in the agentLogUploader servlet in ZOHO ManageEngine Desktop Central (DC) and Desktop Central Managed Service Providers (MSP) edition before 9 build 90055 allows remote attackers to write to and execute arbitrary files as SYSTEM via a .. (dot dot) in the filename parameter.,9.8,NETWORK,LOW,NONE,NONE,UNCHANGED,HIGH,HIGH,HIGH
CVE-2014-5008,2017-03-31T16:59Z,2017-04-04T16:57Z,Snoopy allows remote attackers to execute arbitrary commands.,9.8,NETWORK,LOW,NONE,NONE,UNCHANGED,HIGH,HIGH,HIGH
CVE-2014-5009,2017-03-31T16:59Z,2017-08-29T01:35Z,Snoopy allows remote attackers to execute arbitrary commands.  NOTE: this vulnerability exists due to an incomplete fix for CVE-2014-5008.,9.8,NETWORK,LOW,NONE,NONE,UNCHANGED,HIGH,HIGH,HIGH
CVE-2014-5011,2020-01-10T06:15Z,2020-01-13T20:58Z,DOMPDF before 0.6.2 allows Information Disclosure.,6.5,NETWORK,LOW,NONE,REQUIRED,UNCHANGED,HIGH,NONE,NONE
CVE-2014-5012,2020-01-10T06:15Z,2020-01-13T20:59Z,DOMPDF before 0.6.2 allows denial of service.,6.5,NETWORK,LOW,NONE,REQUIRED,UNCHANGED,NONE,NONE,HIGH
CVE-2014-5013,2020-01-10T06:15Z,2020-01-13T21:00Z,"DOMPDF before 0.6.2 allows remote code execution, a related issue to CVE-2014-2383.",8.8,NETWORK,LOW,NONE,REQUIRED,UNCHANGED,HIGH,HIGH,HIGH
CVE-2014-5014,2018-04-25T17:29Z,2018-05-25T15:25Z,The WordPress Flash Uploader plugin before 3.1.3 for WordPress allows remote attackers to execute arbitrary commands via vectors related to invalid characters in image_magic_path.,9.8,NETWORK,LOW,NONE,NONE,UNCHANGED,HIGH,HIGH,HIGH
CVE-2014-5028,2018-03-29T18:29Z,2018-04-24T12:58Z,The Original File and Patched File resources in Review Board 1.7.x before 1.7.27 and 2.0.x before 2.0.4 allow remote authenticated users to bypass intended access restrictions and obtain sensitive information from repository files by leveraging knowledge of database ids.,6.5,NETWORK,LOW,LOW,NONE,UNCHANGED,HIGH,NONE,NONE
CVE-2014-5034,2018-04-06T16:29Z,2018-05-09T19:00Z,Cross-site request forgery (CSRF) vulnerability in the Brute Force Login Protection module 1.3 for WordPress allows remote attackers to hijack the authentication of unspecified users for requests that have unknown impact via a crafted request to the brute-force-login-protection page to wp-admin/options-general.php.,8.8,NETWORK,LOW,NONE,REQUIRED,UNCHANGED,HIGH,HIGH,HIGH
CVE-2014-5039,2020-01-31T22:15Z,2020-02-05T18:37Z,Cross-site scripting (XSS) vulnerability in Eucalyptus Management Console (EMC) 4.0.x before 4.0.2 allows remote attackers to inject arbitrary web script or HTML via unspecified vectors.,9.6,NETWORK,LOW,NONE,REQUIRED,CHANGED,HIGH,HIGH,HIGH
CVE-2014-5040,2016-01-05T02:59Z,2016-01-05T19:42Z,HP Helion Eucalyptus 4.1.x before 4.1.2 and HPE Helion Eucalyptus 4.2.x before 4.2.1 allow remote authenticated users to bypass intended access restrictions and modify arbitrary (1) access key credentials by leveraging knowledge of a key ID or (2) signing certificates by leveraging knowledge of a certificate ID.,6.8,NETWORK,HIGH,LOW,NONE,UNCHANGED,HIGH,HIGH,NONE
CVE-2014-5044,2018-03-07T15:29Z,2018-03-27T23:48Z,Multiple integer overflows in libgfortran might allow remote attackers to execute arbitrary code or cause a denial of service (Fortran application crash) via vectors related to array allocation.,9.8,NETWORK,LOW,NONE,NONE,UNCHANGED,HIGH,HIGH,HIGH
CVE-2014-5068,2018-01-11T16:29Z,2021-09-13T12:10Z,Directory traversal vulnerability in the web application in Symmetricom s350i 2.70.15 allows remote attackers to read arbitrary files via a (1) ../ (dot dot slash) or (2) ..\ (dot dot forward slash) before a file name.,7.5,NETWORK,LOW,NONE,NONE,UNCHANGED,HIGH,NONE,NONE
CVE-2014-5069,2018-01-08T19:29Z,2021-09-13T12:10Z,Cross-site scripting (XSS) vulnerability in Symmetricom s350i 2.70.15 allows remote attackers to inject arbitrary web script or HTML via vectors involving system logs.,6.1,NETWORK,LOW,NONE,REQUIRED,CHANGED,LOW,LOW,NONE
CVE-2014-5070,2018-01-11T16:29Z,2021-09-13T12:22Z,Symmetricom s350i 2.70.15 allows remote authenticated users to gain privileges via vectors related to pushing unauthenticated users to the login page.,8.8,NETWORK,LOW,LOW,NONE,UNCHANGED,HIGH,HIGH,HIGH
CVE-2014-5071,2018-01-08T19:29Z,2021-09-13T12:10Z,SQL injection vulnerability in the checkPassword function in Symmetricom s350i 2.70.15 allows remote attackers to execute arbitrary SQL commands via vectors involving a username.,9.8,NETWORK,LOW,NONE,NONE,UNCHANGED,HIGH,HIGH,HIGH
CVE-2014-5072,2018-04-06T16:29Z,2018-05-09T20:40Z,Cross-site request forgery (CSRF) vulnerability in WP Security Audit Log plugin before 1.2.5 for WordPress allows remote attackers to hijack the authentication of unspecified victims via unknown vectors.,8.8,NETWORK,LOW,NONE,REQUIRED,UNCHANGED,HIGH,HIGH,HIGH
CVE-2014-5081,2020-01-10T13:15Z,2021-08-16T18:11Z,"sphider prior to 1.3.6, sphider-pro prior to 3.2, and sphider-plus prior to 3.2 allow authentication bypass",9.8,NETWORK,LOW,NONE,NONE,UNCHANGED,HIGH,HIGH,HIGH
CVE-2014-5083,2020-02-10T15:15Z,2020-02-14T19:30Z,"A Command Execution vulnerability exists in Sphider before 1.3.6 due to insufficient sanitization of fwrite to conf.php, which could let a remote malicious user execute arbitrary code. CVE-2014-5083 pertains to instances of fwrite in Sphider.",8.8,NETWORK,LOW,LOW,NONE,UNCHANGED,HIGH,HIGH,HIGH
CVE-2014-5084,2020-02-10T15:15Z,2021-08-16T18:11Z,"A Command Execution vulnerability exists in Sphider Pro 3.2 due to insufficient sanitization of fwrite, which could let a remote malicious user execute arbitrary code. CVE-2014-5084 pertains to instances of fwrite in Sphider Pro only, but do not exist in either Sphider or Sphider Plus.",8.8,NETWORK,LOW,LOW,NONE,UNCHANGED,HIGH,HIGH,HIGH
CVE-2014-5085,2020-02-10T15:15Z,2020-02-14T19:56Z,"A Command Execution vulnerability exists in Sphider Plus 3.2 due to insufficient sanitization of fwrite to conf.php, which could let a remote malicious user execute arbitrary code. CVE-2014-5085 pertains to instances of fwrite in Sphider Plus, but do not exist in either Sphider or Sphider Pro.",8.8,NETWORK,LOW,LOW,NONE,UNCHANGED,HIGH,HIGH,HIGH
CVE-2014-5086,2020-02-10T15:15Z,2021-09-09T13:38Z,"A Command Execution vulnerability exists in Sphider Pro, and Sphider Plus 3.2 due to insufficient sanitization of fwrite to conf.php, which could let a remote malicious user execute arbitrary code. CVE-2014-5086 pertains to instances of fwrite in Sphider Pro and Sphider Plus only, but dont exist in Sphider.",8.8,NETWORK,LOW,LOW,NONE,UNCHANGED,HIGH,HIGH,HIGH
CVE-2014-5087,2020-02-07T18:15Z,2021-08-16T18:11Z,"A vulnerability exists in Sphider Search Engine prior to 1.3.6 due to exec calls in admin/spiderfuncs.php, which could let a remote malicious user execute arbitrary code.",9.8,NETWORK,LOW,NONE,NONE,UNCHANGED,HIGH,HIGH,HIGH
CVE-2014-5091,2020-02-07T18:15Z,2020-02-11T01:38Z,"A vulnerability exits in Status2K 2.5 Server Monitoring Software via the multies parameter to includes/functions.php, which could let a malicious user execute arbitrary PHP code.",9.8,NETWORK,LOW,NONE,NONE,UNCHANGED,HIGH,HIGH,HIGH
CVE-2014-5092,2020-01-10T14:15Z,2020-01-21T20:23Z,Status2k allows Remote Command Execution in admin/options/editpl.php.,8.8,NETWORK,LOW,LOW,NONE,UNCHANGED,HIGH,HIGH,HIGH
CVE-2014-5093,2020-01-10T14:15Z,2020-01-14T14:46Z,Status2k does not remove the install directory allowing credential reset.,9.8,NETWORK,LOW,NONE,NONE,UNCHANGED,HIGH,HIGH,HIGH
CVE-2014-5118,2019-11-18T23:15Z,2020-01-10T14:15Z,Trusted Boot (tboot) before 1.8.2 has a 'loader.c' Security Bypass Vulnerability,5.5,LOCAL,LOW,LOW,NONE,UNCHANGED,NONE,HIGH,NONE
CVE-2014-5130,2018-03-27T21:29Z,2019-03-11T19:22Z,Avolve Software ProjectDox 8.1 allows remote authenticated users to obtain sensitive information from other users via vectors involving a direct access token.,6.5,NETWORK,LOW,LOW,NONE,UNCHANGED,HIGH,NONE,NONE
CVE-2014-5131,2018-03-27T21:29Z,2019-03-11T19:26Z,Avolve Software ProjectDox 8.1 makes it easier for remote authenticated users to obtain sensitive information by leveraging ciphertext reuse.,6.5,NETWORK,LOW,LOW,NONE,UNCHANGED,HIGH,NONE,NONE
CVE-2014-5132,2018-03-27T21:29Z,2019-03-11T19:24Z,Avolve Software ProjectDox 8.1 allows remote attackers to enumerate users via vectors related to email addresses.,4.3,NETWORK,LOW,LOW,NONE,UNCHANGED,LOW,NONE,NONE
CVE-2014-5138,2020-01-14T16:15Z,2020-01-21T16:20Z,"Innovative Interfaces Sierra Library Services Platform 1.2_3 does not properly handle query strings with multiple instances of the same parameter, which allows remote attackers to bypass parameter validation via unspecified vectors, possibly related to the Webpac Pro submodule.",7.5,NETWORK,LOW,NONE,NONE,UNCHANGED,NONE,HIGH,NONE
CVE-2014-5140,2020-01-03T20:15Z,2020-01-14T21:26Z,"The bindReplace function in the query factory in includes/classes/database.php in Loaded Commerce 7 does not properly handle : (colon) characters, which allows remote authenticated users to conduct SQL injection attacks via the First name and Last name fields in the address book.",8.8,NETWORK,LOW,LOW,NONE,UNCHANGED,HIGH,HIGH,HIGH
CVE-2014-5144,2017-08-09T18:29Z,2017-08-18T12:18Z,Cross-site scripting (XSS) vulnerability in Telescope before 0.9.3 allows remote authenticated users to inject arbitrary web script or HTML via crafted markdown.,5.4,NETWORK,LOW,LOW,REQUIRED,CHANGED,LOW,LOW,NONE
CVE-2014-5170,2018-03-29T18:29Z,2018-04-27T16:05Z,The Storage API module 7.x before 7.x-1.6 for Drupal might allow remote attackers to execute arbitrary code by leveraging failure to update .htaccess file contents after SA-CORE-2013-003.,9.8,NETWORK,LOW,NONE,NONE,UNCHANGED,HIGH,HIGH,HIGH
CVE-2014-5209,2020-01-08T01:15Z,2020-01-24T19:19Z,"An Information Disclosure vulnerability exists in NTP 4.2.7p25 private (mode 6/7) messages via a GET_RESTRICT control message, which could let a malicious user obtain sensitive information.",5.3,NETWORK,LOW,NONE,NONE,UNCHANGED,LOW,NONE,NONE
CVE-2014-5220,2018-06-08T17:29Z,2019-07-16T12:24Z,"The mdcheck script of the mdadm package for openSUSE 13.2 prior to version 3.3.1-5.14.1 does not properly sanitize device names, which allows local attackers to execute arbitrary commands as root.",7.8,LOCAL,LOW,LOW,NONE,UNCHANGED,HIGH,HIGH,HIGH
CVE-2014-5236,2020-01-31T22:15Z,2020-02-06T19:54Z,Multiple absolute path traversal vulnerabilities in documentconverter in Open-Xchange (OX) AppSuite before 7.4.2-rev10 and 7.6.x before 7.6.0-rev10 allow remote attackers to read application files via a full pathname in a crafted (1) OLE Object or (2) image in an OpenDocument text file.,7.5,NETWORK,LOW,NONE,NONE,UNCHANGED,HIGH,NONE,NONE
CVE-2014-5238,2020-01-14T16:15Z,2020-01-28T19:22Z,XML external entity (XXE) vulnerability in Open-Xchange (OX) AppSuite before 7.4.2-rev11 and 7.6.x before 7.6.0-rev9 allows remote attackers to read arbitrary files and possibly other unspecified impact via a crafted OpenDocument Text document.,7.8,LOCAL,LOW,NONE,REQUIRED,UNCHANGED,HIGH,HIGH,HIGH
CVE-2014-5254,2019-11-21T23:15Z,2019-11-26T19:58Z,xcfa before 5.0.1 creates temporary files insecurely which could allow local users to launch a symlink attack and overwrite arbitrary files.,4.7,LOCAL,HIGH,LOW,NONE,UNCHANGED,NONE,HIGH,NONE
CVE-2014-5255,2019-11-21T23:15Z,2020-08-18T15:05Z,xcfa before 5.0.1 creates temporary files insecurely which could allow local users to launch a symlink attack and overwrite arbitrary files. Note: A different vulnerability than CVE-2014-5254.,7.0,LOCAL,HIGH,LOW,NONE,UNCHANGED,HIGH,HIGH,HIGH
CVE-2014-5278,2020-02-07T18:15Z,2020-02-11T01:23Z,"A vulnerability exists in Docker before 1.2 via container names, which may collide with and override container IDs.",5.3,NETWORK,LOW,NONE,NONE,UNCHANGED,NONE,LOW,NONE
CVE-2014-5279,2018-02-06T16:29Z,2019-04-29T17:14Z,"The Docker daemon managed by boot2docker 1.2 and earlier improperly enables unauthenticated TCP connections by default, which makes it easier for remote attackers to gain privileges or execute arbitrary code from children containers.",8.8,NETWORK,LOW,LOW,NONE,UNCHANGED,HIGH,HIGH,HIGH
CVE-2014-5280,2018-02-06T16:29Z,2020-01-30T18:05Z,boot2docker 1.2 and earlier allows attackers to conduct cross-site request forgery (CSRF) attacks by leveraging Docker daemons enabling TCP connections without TLS authentication.,8.8,NETWORK,LOW,NONE,REQUIRED,UNCHANGED,HIGH,HIGH,HIGH
CVE-2014-5282,2018-02-06T16:29Z,2019-04-29T17:11Z,"Docker before 1.3 does not properly validate image IDs, which allows remote attackers to redirect to another image through the loading of untrusted images via 'docker load'.",8.1,NETWORK,LOW,LOW,NONE,UNCHANGED,HIGH,HIGH,NONE
CVE-2014-5287,2020-01-08T17:15Z,2020-01-13T16:10Z,A Bash script injection vulnerability exists in Kemp Load Master 7.1-16 and earlier due to a failure to sanitize input in the Web User Interface (WUI).,8.8,NETWORK,LOW,NONE,REQUIRED,UNCHANGED,HIGH,HIGH,HIGH
CVE-2014-5288,2020-02-07T17:15Z,2020-02-11T16:08Z,A CSRF Vulnerability exists in Kemp Load Master before 7.0-18a via unspecified vectors in administrative pages.,8.8,NETWORK,LOW,NONE,REQUIRED,UNCHANGED,HIGH,HIGH,HIGH
CVE-2014-5289,2019-12-27T21:15Z,2019-12-31T16:29Z,Buffer overflow in Senkas Kolibri 2.0 allows remote attackers to execute arbitrary code via a long URI in a POST request.,9.8,NETWORK,LOW,NONE,NONE,UNCHANGED,HIGH,HIGH,HIGH
CVE-2014-5301,2017-08-28T15:29Z,2018-10-09T19:50Z,Directory traversal vulnerability in ServiceDesk Plus MSP v5 to v9.0 v9030; AssetExplorer v4 to v6.1; SupportCenter v5 to v7.9; IT360 v8 to v10.4.,8.8,NETWORK,LOW,LOW,NONE,UNCHANGED,HIGH,HIGH,HIGH
CVE-2014-5302,2017-08-28T15:29Z,2018-10-09T19:50Z,Directory traversal vulnerability in ServiceDesk Plus and Plus MSP v5 through v9.0 v9030; AssetExplorer v4 to v6.1; SupportCenter v5 to v7.9; IT360 v8 to v10.4 allows remote authenticated users to execute arbitrary code.,8.8,NETWORK,LOW,LOW,NONE,UNCHANGED,HIGH,HIGH,HIGH
CVE-2014-5334,2018-01-08T19:29Z,2018-01-29T13:17Z,"FreeNAS before 9.3-M3 has a blank admin password, which allows remote attackers to gain root privileges by leveraging a WebGui login.",9.8,NETWORK,LOW,NONE,NONE,UNCHANGED,HIGH,HIGH,HIGH
CVE-2014-5362,2017-09-19T15:29Z,2018-10-09T19:50Z,The admin interface in Landesk Management Suite 9.6 and earlier allows remote attackers to conduct remote file inclusion attacks involving ASPX pages from third-party sites via the d parameter to (1) ldms/sm_actionfrm.asp or (2) remote/frm_coremainfrm.aspx; or the (3) top parameter to remote/frm_splitfrm.aspx.,7.2,NETWORK,LOW,HIGH,NONE,UNCHANGED,HIGH,HIGH,HIGH
CVE-2014-5380,2020-01-13T13:15Z,2020-01-23T15:38Z,Grand MA 300 allows retrieval of the access PIN from sniffed data.,7.5,NETWORK,LOW,NONE,NONE,UNCHANGED,HIGH,NONE,NONE
CVE-2014-5381,2020-01-13T13:15Z,2020-01-15T20:58Z,Grand MA 300 allows a brute-force attack on the PIN.,9.8,NETWORK,LOW,NONE,NONE,UNCHANGED,HIGH,HIGH,HIGH
CVE-2014-5394,2018-01-08T19:29Z,2018-01-29T19:03Z,Multiple Huawei Campus switches allow remote attackers to enumerate usernames via vectors involving use of SSH by the maintenance terminal.,5.9,NETWORK,HIGH,NONE,NONE,UNCHANGED,HIGH,NONE,NONE
CVE-2014-5401,2019-03-26T17:29Z,2019-10-09T23:11Z,"Hospira MedNet software version 5.8 and prior uses vulnerable versions of the JBoss Enterprise Application Platform software that may allow unauthenticated users to execute arbitrary code on the target system. Hospira has developed a new version of the MedNet software, MedNet 6.1. Existing versions of MedNet can be upgraded to MedNet 6.1.",9.8,NETWORK,LOW,NONE,NONE,UNCHANGED,HIGH,HIGH,HIGH
CVE-2014-5414,2016-10-05T10:59Z,2016-11-28T19:12Z,"Beckhoff Embedded PC images before 2014-10-22 and Automation Device Specification (ADS) TwinCAT components do not restrict the number of authentication attempts, which makes it easier for remote attackers to obtain access via a brute-force attack.",9.1,NETWORK,LOW,NONE,NONE,UNCHANGED,HIGH,HIGH,NONE
CVE-2014-5415,2016-10-05T10:59Z,2016-11-28T19:12Z,"Beckhoff Embedded PC images before 2014-10-22 and Automation Device Specification (ADS) TwinCAT components might allow remote attackers to obtain access via the (1) Windows CE Remote Configuration Tool, (2) CE Remote Display service, or (3) TELNET service.",9.1,NETWORK,LOW,NONE,NONE,UNCHANGED,HIGH,HIGH,NONE
CVE-2014-5431,2019-03-26T16:29Z,2019-10-09T23:11Z,"Baxter SIGMA Spectrum Infusion System version 6.05 (model 35700BAX) with wireless battery module (WBM) version 16 contains a hard-coded password, which provides access to basic biomedical information, limited device settings, and network configuration of the WBM, if connected. The hard-coded password may allow an attacker with physical access to the device to access management functions to make unauthorized configuration changes to biomedical settings such as turn on and off wireless connections and the phase-complete audible alarm that indicates the end of an infusion phase. Baxter has released a new version of the SIGMA Spectrum Infusion System, version 8, which incorporates hardware and software changes.",6.8,PHYSICAL,LOW,NONE,NONE,UNCHANGED,HIGH,HIGH,HIGH
CVE-2014-5432,2019-03-26T16:29Z,2019-10-09T23:11Z,"Baxter SIGMA Spectrum Infusion System version 6.05 (model 35700BAX) with wireless battery module (WBM) version 16 is remotely accessible via Port 22/SSH without authentication. A remote attacker may be able to make unauthorized configuration changes to the WBM, as well as issue commands to access account credentials and shared keys. Baxter asserts that this vulnerability only allows access to features and functionality on the WBM and that the SIGMA Spectrum infusion pump cannot be controlled from the WBM. Baxter has released a new version of the SIGMA Spectrum Infusion System, Version 8, which incorporates hardware and software changes.",9.8,NETWORK,LOW,NONE,NONE,UNCHANGED,HIGH,HIGH,HIGH
CVE-2014-5433,2019-03-26T16:29Z,2019-10-09T23:11Z,"An unauthenticated remote attacker may be able to execute commands to view wireless account credentials that are stored in cleartext on Baxter SIGMA Spectrum Infusion System version 6.05 (model 35700BAX) with wireless battery module (WBM) version 16, which may allow an attacker to gain access the host network. Baxter has released a new version of the SIGMA Spectrum Infusion System, Version 8, which incorporates hardware and software changes.",9.8,NETWORK,LOW,NONE,NONE,UNCHANGED,HIGH,HIGH,HIGH
CVE-2014-5434,2019-03-26T15:29Z,2019-10-09T23:11Z,"Baxter SIGMA Spectrum Infusion System version 6.05 (model 35700BAX) with wireless battery module (WBM) version 16 has a default account with hard-coded credentials used with the FTP protocol. Baxter asserts no files can be transferred to or from the WBM using this account. Baxter has released a new version of the SIGMA Spectrum Infusion System, Version 8, which incorporates hardware and software changes.",9.8,NETWORK,LOW,NONE,NONE,UNCHANGED,HIGH,HIGH,HIGH
CVE-2014-5435,2019-04-08T16:29Z,2019-10-09T23:11Z,"An arbitrary memory write vulnerability exists in the dual_onsrv.exe module in Honeywell Experion PKS R40x before R400.6, R41x before R410.6, and R43x before R430.2, that could lead to possible remote code execution or denial of service. Honeywell strongly encourages and recommends all customers running unsupported versions of EKPS prior to R400 to upgrade to a supported version.",9.8,NETWORK,LOW,NONE,NONE,UNCHANGED,HIGH,HIGH,HIGH
CVE-2014-5436,2019-04-08T16:29Z,2019-10-09T23:11Z,"A directory traversal vulnerability exists in the confd.exe module in Honeywell Experion PKS R40x before R400.6, R41x before R410.6, and R43x before R430.2, which could lead to possible information disclosure. Honeywell strongly encourages and recommends all customers running unsupported versions of EKPS prior to R400 to upgrade to a supported version.",7.5,NETWORK,LOW,NONE,NONE,UNCHANGED,HIGH,NONE,NONE
CVE-2014-5439,2019-11-19T16:15Z,2020-08-18T15:05Z,"Multiple Stack-based Buffer Overflow vulnerabilities exists in Sniffit prior to 0.3.7 via a crafted configuration file that will bypass Non-eXecutable bit NX, stack smashing protector SSP, and address space layout randomization ASLR protection mechanisms, which could let a malicious user execute arbitrary code.",7.8,LOCAL,LOW,NONE,REQUIRED,UNCHANGED,HIGH,HIGH,HIGH
CVE-2014-5443,2018-03-19T21:29Z,2018-04-20T14:55Z,Seafile Server before 3.1.2 and Server Professional Edition before 3.1.0 allow local users to gain privileges via vectors related to ccnet handling user accounts.,7.8,LOCAL,LOW,LOW,NONE,UNCHANGED,HIGH,HIGH,HIGH
CVE-2014-5450,2018-03-19T21:29Z,2018-04-20T14:56Z,"Zarafa Collaboration Platform 4.1 uses world-readable permissions for /etc/zarafa/license, which allows local users to obtain sensitive information by reading license files.",5.5,LOCAL,LOW,LOW,NONE,UNCHANGED,HIGH,NONE,NONE
CVE-2014-5468,2020-02-07T17:15Z,2020-02-11T16:02Z,"A File Inclusion vulnerability exists in Railo 4.2.1 and earlier via a specially-crafted URL request to the thumbnail.cfm to specify a malicious PNG file, which could let a remote malicious user obtain sensitive information or execute arbitrary code.",8.8,NETWORK,LOW,NONE,REQUIRED,UNCHANGED,HIGH,HIGH,HIGH
CVE-2014-5500,2020-01-27T19:15Z,2020-01-28T21:17Z,Synacor Zimbra Collaboration before 8.0.8 has XSS.,6.1,NETWORK,LOW,NONE,REQUIRED,CHANGED,LOW,LOW,NONE
CVE-2014-5509,2018-01-08T19:29Z,2018-02-02T17:39Z,clipedit in the Clipboard module for Perl allows local users to delete arbitrary files via a symlink attack on /tmp/clipedit$$.,5.5,LOCAL,LOW,LOW,NONE,UNCHANGED,NONE,HIGH,NONE
CVE-2014-5516,2020-01-03T20:15Z,2020-01-15T20:36Z,Cross-site request forgery (CSRF) vulnerability in the Storefront Application in DS Data Systems KonaKart before 7.3.0.0 allows remote attackers to hijack the authentication of administrators for requests that change a user email address via an unspecified GET request.,6.5,NETWORK,LOW,NONE,REQUIRED,UNCHANGED,NONE,HIGH,NONE
CVE-2014-6027,2018-01-16T19:29Z,2018-02-05T14:29Z,Multiple cross-site scripting (XSS) vulnerabilities in TorrentFlux 2.4 allow (1) remote attackers to inject arbitrary web script or HTML by leveraging failure to encode file contents when downloading a torrent file or (2) remote authenticated users to inject arbitrary web script or HTML via vectors involving a link to torrent details.,6.1,NETWORK,LOW,NONE,REQUIRED,CHANGED,LOW,LOW,NONE
CVE-2014-6031,2017-06-08T16:29Z,2019-06-06T15:11Z,"Buffer overflow in the mcpq daemon in F5 BIG-IP systems 10.x before 10.2.4 HF12, 11.x before 11.2.1 HF15, 11.3.x, 11.4.x before 11.4.1 HF9, 11.5.x before 11.5.2 HF1, and 11.6.0 before HF4, and Enterprise Manager 2.1.0 through 2.3.0 and 3.x before 3.1.1 HF5 allows remote authenticated administrators to cause a denial of service via unspecified vectors.",4.9,NETWORK,LOW,HIGH,NONE,UNCHANGED,NONE,NONE,HIGH
CVE-2014-6038,2020-01-13T13:15Z,2020-03-26T14:15Z,Zoho ManageEngine EventLog Analyzer versions 7 through 9.9 build 9002 have a database Information Disclosure Vulnerability. Fixed in EventLog Analyzer 10.0 Build 10000.,7.5,NETWORK,LOW,NONE,NONE,UNCHANGED,HIGH,NONE,NONE
CVE-2014-6039,2020-01-13T13:15Z,2020-03-26T14:15Z,ManageEngine EventLog Analyzer version 7 through 9.9 build 9002 has a Credentials Disclosure Vulnerability. Fixed version 10 Build 10000.,7.5,NETWORK,LOW,NONE,NONE,UNCHANGED,HIGH,NONE,NONE
CVE-2014-6045,2018-08-28T17:29Z,2018-10-31T19:55Z,SQL injection vulnerability in phpMyFAQ before 2.8.13 allows remote authenticated users with certain permissions to execute arbitrary SQL commands via vectors involving the restore function.,7.2,NETWORK,LOW,HIGH,NONE,UNCHANGED,HIGH,HIGH,HIGH
CVE-2014-6046,2018-08-28T17:29Z,2018-11-01T17:11Z,"Multiple cross-site request forgery (CSRF) vulnerabilities in phpMyFAQ before 2.8.13 allow remote attackers to hijack the authentication of unspecified users for requests that (1) delete active users by leveraging improper validation of CSRF tokens or that (2) delete open questions, (3) activate users, (4) publish FAQs, (5) add or delete Glossary, (6) add or delete FAQ news, or (7) add or delete comments or add votes by leveraging lack of a CSRF token.",8.8,NETWORK,LOW,NONE,REQUIRED,UNCHANGED,HIGH,HIGH,HIGH
CVE-2014-6047,2018-08-28T17:29Z,2018-10-23T18:46Z,"phpMyFAQ before 2.8.13 allows remote authenticated users with certain permissions to read arbitrary attachments by leveraging incorrect ""download an attachment"" permission checks.",5.3,NETWORK,LOW,NONE,NONE,UNCHANGED,LOW,NONE,NONE
