CVE_ID,PublishTime,ModifyTime,Report,CVSSV3,AttackVector,AttackComplexity,PrivilegesRequired,UserInteraction,Scope,ConfidentialityImpact,IntegrityImpact,AvailabilityImpact
CVE-2014-0011,2020-01-02T20:15Z,2020-01-14T17:29Z,"Multiple heap-based buffer overflows in the ZRLE_DECODE function in common/rfb/zrleDecode.h in TigerVNC before 1.3.1, when NDEBUG is enabled, allow remote VNC servers to cause a denial of service (vncviewer crash) and possibly execute arbitrary code via vectors related to screen image rendering.",9.8,NETWORK,LOW,NONE,NONE,UNCHANGED,HIGH,HIGH,HIGH
CVE-2014-0013,2018-02-15T21:29Z,2018-08-13T21:47Z,"Ember.js 1.0.x before 1.0.1, 1.1.x before 1.1.3, 1.2.x before 1.2.1, 1.3.x before 1.3.1, and 1.4.x before 1.4.0-beta.2 allows remote attackers to conduct cross-site scripting (XSS) attacks by leveraging an application that contains templates whose context is set to a user-supplied primitive value and also contain the `{{this}}` special Handlebars variable.",5.4,NETWORK,LOW,LOW,REQUIRED,CHANGED,LOW,LOW,NONE
CVE-2014-0014,2018-02-15T21:29Z,2018-10-17T01:29Z,"Ember.js 1.0.x before 1.0.1, 1.1.x before 1.1.3, 1.2.x before 1.2.1, 1.3.x before 1.3.1, and 1.4.x before 1.4.0-beta.2 allows remote attackers to conduct cross-site scripting (XSS) attacks by leveraging an application using the ""{{group}}"" Helper and a crafted payload.",5.4,NETWORK,LOW,LOW,REQUIRED,CHANGED,LOW,LOW,NONE
CVE-2014-0021,2019-11-15T15:15Z,2020-08-18T15:05Z,Chrony before 1.29.1 has traffic amplification in cmdmon protocol,7.5,NETWORK,LOW,NONE,NONE,UNCHANGED,NONE,NONE,HIGH
CVE-2014-0023,2019-11-15T15:15Z,2019-11-20T15:17Z,OpenShift: Install script has temporary file creation vulnerability which can result in arbitrary code execution,7.8,LOCAL,LOW,LOW,NONE,UNCHANGED,HIGH,HIGH,HIGH
CVE-2014-0026,2019-12-11T15:15Z,2019-12-13T21:11Z,katello-headpin is vulnerable to CSRF in REST API,6.5,NETWORK,LOW,NONE,REQUIRED,UNCHANGED,NONE,HIGH,NONE
CVE-2014-0029,2017-10-16T13:29Z,2017-11-07T18:22Z,Multiple cross-site scripting (XSS) vulnerabilities in the SAM web application in Red Hat katello-headpin allow remote attackers to inject arbitrary web script or HTML via unspecified parameters.,6.1,NETWORK,LOW,NONE,REQUIRED,CHANGED,LOW,LOW,NONE
CVE-2014-0030,2017-10-10T01:30Z,2019-05-06T20:38Z,The XML-RPC protocol support in Apache Roller before 5.0.3 allows attackers to conduct XML External Entity (XXE) attacks via unspecified vectors.,9.8,NETWORK,LOW,NONE,NONE,UNCHANGED,HIGH,HIGH,HIGH
CVE-2014-0043,2017-10-03T01:29Z,2017-10-11T17:32Z,"In Apache Wicket 1.5.10 or 6.13.0, by issuing requests to special urls handled by Wicket, it is possible to check for the existence of particular classes in the classpath and thus check whether a third party library with a known security vulnerability is in use.",5.3,NETWORK,LOW,NONE,NONE,UNCHANGED,LOW,NONE,NONE
CVE-2014-0047,2017-10-06T15:29Z,2017-10-13T19:45Z,Docker before 1.5 allows local users to have unspecified impact via vectors involving unsafe /tmp usage.,7.8,LOCAL,LOW,LOW,NONE,UNCHANGED,HIGH,HIGH,HIGH
CVE-2014-0048,2020-01-02T17:15Z,2020-08-31T14:15Z,An issue was found in Docker before 1.6.0. Some programs and scripts in Docker are downloaded via HTTP and then executed or used in unsafe ways.,9.8,NETWORK,LOW,NONE,NONE,UNCHANGED,HIGH,HIGH,HIGH
CVE-2014-0072,2017-10-30T19:29Z,2018-10-09T19:35Z,ios/CDVFileTransfer.m in the Apache Cordova File-Transfer standalone plugin (org.apache.cordova.file-transfer) before 0.4.2 for iOS and the File-Transfer plugin for iOS from Cordova 2.4.0 through 2.9.0 might allow remote attackers to spoof SSL servers by leveraging a default value of true for the trustAllHosts option.,7.5,NETWORK,LOW,NONE,NONE,UNCHANGED,NONE,HIGH,NONE
CVE-2014-0073,2017-10-30T19:29Z,2018-10-09T19:35Z,"The CDVInAppBrowser class in the Apache Cordova In-App-Browser standalone plugin (org.apache.cordova.inappbrowser) before 0.3.2 for iOS and the In-App-Browser plugin for iOS from Cordova 2.6.0 through 2.9.0 does not properly validate callback identifiers, which allows remote attackers to execute arbitrary JavaScript in the host page and consequently gain privileges via a crafted gap-iab: URI.",9.8,NETWORK,LOW,NONE,NONE,UNCHANGED,HIGH,HIGH,HIGH
CVE-2014-0083,2019-11-21T14:15Z,2020-08-18T15:05Z,The Ruby net-ldap gem before 0.11 uses a weak salt when generating SSHA passwords.,5.5,LOCAL,LOW,LOW,NONE,UNCHANGED,HIGH,NONE,NONE
CVE-2014-0084,2019-11-21T15:15Z,2019-11-25T17:35Z,Ruby gem openshift-origin-node before 2014-02-14 does not contain a cronjob timeout which could result in a denial of service in cron.daily and cron.weekly.,5.5,LOCAL,LOW,LOW,NONE,UNCHANGED,NONE,NONE,HIGH
CVE-2014-0087,2018-01-11T16:29Z,2018-12-18T17:28Z,"The check_privileges method in vmdb/app/controllers/application_controller.rb in ManageIQ, as used in Red Hat CloudForms Management Engine (CFME), allows remote authenticated users to bypass authorization and gain privileges by leveraging improper RBAC checking, related to the rbac_user_edit action.",8.8,NETWORK,LOW,LOW,NONE,UNCHANGED,HIGH,HIGH,HIGH
CVE-2014-0091,2019-12-11T15:15Z,2019-12-16T13:12Z,Foreman has improper input validation which could lead to partial Denial of Service,5.3,NETWORK,LOW,NONE,NONE,UNCHANGED,NONE,NONE,LOW
CVE-2014-0097,2017-05-25T17:29Z,2021-06-08T18:22Z,The ActiveDirectoryLdapAuthenticator in Spring Security 3.2.0 to 3.2.1 and 3.1.0 to 3.1.5 does not check the password length. If the directory allows anonymous binds then it may incorrectly authenticate a user who supplies an empty password.,7.3,NETWORK,LOW,NONE,NONE,UNCHANGED,LOW,LOW,LOW
CVE-2014-0104,2020-01-02T17:15Z,2020-01-10T15:20Z,In fence-agents before 4.0.17 does not verify remote SSL certificates in the fence_cisco_ucs.py script which can potentially allow for man-in-the-middle attackers to spoof SSL servers via arbitrary SSL certificates.,5.9,NETWORK,HIGH,NONE,NONE,UNCHANGED,NONE,HIGH,NONE
CVE-2014-0115,2017-10-30T16:29Z,2017-11-15T13:38Z,Directory traversal vulnerability in the log viewer in Apache Storm 0.9.0.1 allows remote attackers to read arbitrary files via a .. (dot dot) in the file parameter to log.,7.5,NETWORK,LOW,NONE,NONE,UNCHANGED,HIGH,NONE,NONE
CVE-2014-0120,2017-12-29T22:29Z,2018-01-11T13:46Z,"Cross-site request forgery (CSRF) vulnerability in the admin terminal in Hawt.io allows remote attackers to hijack the authentication of arbitrary users for requests that run commands on the Karaf server, as demonstrated by running ""shutdown -f.""",8.8,NETWORK,LOW,NONE,REQUIRED,UNCHANGED,HIGH,HIGH,HIGH
CVE-2014-0121,2017-12-29T22:29Z,2018-01-11T13:49Z,"The admin terminal in Hawt.io does not require authentication, which allows remote attackers to execute arbitrary commands via the k parameter.",9.8,NETWORK,LOW,NONE,NONE,UNCHANGED,HIGH,HIGH,HIGH
CVE-2014-0141,2017-08-28T15:29Z,2017-08-31T13:47Z,Cross-site scripting (XSS) vulnerability in Red Hat Satellite 6.0.3.,6.1,NETWORK,LOW,NONE,REQUIRED,CHANGED,LOW,LOW,NONE
CVE-2014-0142,2017-08-10T15:29Z,2017-11-04T01:29Z,"QEMU, possibly before 2.0.0, allows local users to cause a denial of service (divide-by-zero error and crash) via a zero value in the (1) tracks field to the seek_to_sector function in block/parallels.c or (2) extent_size field in the bochs function in block/bochs.c.",5.5,LOCAL,LOW,LOW,NONE,UNCHANGED,NONE,NONE,HIGH
CVE-2014-0143,2017-08-10T15:29Z,2019-04-22T17:48Z,"Multiple integer overflows in the block drivers in QEMU, possibly before 2.0.0, allow local users to cause a denial of service (crash) via a crafted catalog size in (1) the parallels_open function in block/parallels.c or (2) bochs_open function in bochs.c, a large L1 table in the (3) qcow2_snapshot_load_tmp in qcow2-snapshot.c or (4) qcow2_grow_l1_table function in qcow2-cluster.c, (5) a large request in the bdrv_check_byte_request function in block.c and other block drivers, (6) crafted cluster indexes in the get_refcount function in qcow2-refcount.c, or (7) a large number of blocks in the cloop_open function in cloop.c, which trigger buffer overflows, memory corruption, large memory allocations and out-of-bounds read and writes.",7.0,LOCAL,HIGH,LOW,NONE,UNCHANGED,HIGH,HIGH,HIGH
CVE-2014-0145,2017-08-10T15:29Z,2017-11-04T01:29Z,"Multiple buffer overflows in QEMU before 1.7.2 and 2.x before 2.0.0, allow local users to cause a denial of service (crash) or possibly execute arbitrary code via a large (1) L1 table in the qcow2_snapshot_load_tmp in the QCOW 2 block driver (block/qcow2-snapshot.c) or (2) uncompressed chunk, (3) chunk length, or (4) number of sectors in the DMG block driver (block/dmg.c).",7.8,LOCAL,LOW,LOW,NONE,UNCHANGED,HIGH,HIGH,HIGH
CVE-2014-0146,2017-08-10T15:29Z,2017-11-04T01:29Z,"The qcow2_open function in the (block/qcow2.c) in QEMU before 1.7.2 and 2.x before 2.0.0 allows local users to cause a denial of service (NULL pointer dereference) via a crafted image which causes an error, related to the initialization of the snapshot_offset and nb_snapshots fields.",5.5,LOCAL,LOW,NONE,REQUIRED,UNCHANGED,NONE,NONE,HIGH
CVE-2014-0158,2018-04-10T15:29Z,2020-09-09T19:56Z,"Heap-based buffer overflow in the JPEG2000 image tile decoder in OpenJPEG before 1.5.2 allows remote attackers to cause a denial of service (application crash) or possibly have unspecified other impact via a crafted file because of incorrect j2k_decode, j2k_read_eoc, and tcd_decode_tile interaction, a related issue to CVE-2013-6045. NOTE: this is not a duplicate of CVE-2013-1447, because the scope of CVE-2013-1447 was specifically defined in http://openwall.com/lists/oss-security/2013/12/04/6 as only ""null pointer dereferences, division by zero, and anything that would just fit as DoS.""",8.8,NETWORK,LOW,NONE,REQUIRED,UNCHANGED,HIGH,HIGH,HIGH
CVE-2014-0160,2014-04-07T22:55Z,2020-10-15T13:29Z,"The (1) TLS and (2) DTLS implementations in OpenSSL 1.0.1 before 1.0.1g do not properly handle Heartbeat Extension packets, which allows remote attackers to obtain sensitive information from process memory via crafted packets that trigger a buffer over-read, as demonstrated by reading private keys, related to d1_both.c and t1_lib.c, aka the Heartbleed bug.",7.5,NETWORK,LOW,NONE,NONE,UNCHANGED,HIGH,NONE,NONE
CVE-2014-0161,2020-01-02T18:15Z,2020-01-10T15:14Z,ovirt-engine-sdk-python before 3.4.0.7 and 3.5.0.4 does not verify that the hostname of the remote endpoint matches the Common Name (CN) or subjectAltName as specified by its x.509 certificate in a TLS/SSL session. This could allow man-in-the-middle attackers to spoof remote endpoints via an arbitrary valid certificate.,5.9,NETWORK,HIGH,NONE,NONE,UNCHANGED,NONE,HIGH,NONE
CVE-2014-0163,2019-12-11T16:15Z,2019-12-16T14:09Z,Openshift has shell command injection flaws due to unsanitized data being passed into shell commands.,8.8,NETWORK,LOW,LOW,NONE,UNCHANGED,HIGH,HIGH,HIGH
CVE-2014-0169,2020-01-02T20:15Z,2020-01-14T17:17Z,"In JBoss EAP 6 a security domain is configured to use a cache that is shared between all applications that are in the security domain. This could allow an authenticated user in one application to access protected resources in another application without proper authorization. Although this is an intended functionality, it was not clearly documented which can mislead users into thinking that a security domain cache is isolated to a single application.",6.5,NETWORK,LOW,LOW,NONE,UNCHANGED,HIGH,NONE,NONE
CVE-2014-0175,2019-12-13T13:15Z,2019-12-18T20:51Z,mcollective has a default password set at install,9.8,NETWORK,LOW,NONE,NONE,UNCHANGED,HIGH,HIGH,HIGH
CVE-2014-0183,2020-01-02T20:15Z,2020-01-10T18:17Z,Versions of Katello as shipped with Red Hat Subscription Asset Manager 1.4 are vulnerable to a XSS via HTML in the systems name when registering.,6.1,NETWORK,LOW,NONE,REQUIRED,CHANGED,LOW,LOW,NONE
CVE-2014-0197,2019-12-13T13:15Z,2019-12-18T19:50Z,CFME: CSRF protection vulnerability via permissive check of the referrer header,8.8,NETWORK,LOW,NONE,REQUIRED,UNCHANGED,HIGH,HIGH,HIGH
CVE-2014-0203,2014-06-23T11:21Z,2020-08-06T18:01Z,"The __do_follow_link function in fs/namei.c in the Linux kernel before 2.6.33 does not properly handle the last pathname component during use of certain filesystems, which allows local users to cause a denial of service (incorrect free operations and system crash) via an open system call.",5.5,LOCAL,LOW,LOW,NONE,UNCHANGED,NONE,NONE,HIGH
CVE-2014-0208,2017-10-16T18:29Z,2017-11-01T11:47Z,Cross-site scripting (XSS) vulnerability in the search auto-completion functionality in Foreman before 1.4.4 allows remote authenticated users to inject arbitrary web script or HTML via a crafted key name.,5.4,NETWORK,LOW,LOW,REQUIRED,CHANGED,LOW,LOW,NONE
CVE-2014-0212,2019-12-13T13:15Z,2019-12-19T15:27Z,qpid-cpp: ACL policies only loaded if the acl-file option specified enabling DoS by consuming all available file descriptors,7.5,NETWORK,LOW,NONE,NONE,UNCHANGED,NONE,NONE,HIGH
CVE-2014-0219,2017-11-15T18:29Z,2019-01-08T14:14Z,"Apache Karaf before 4.0.10 enables a shutdown port on the loopback interface, which allows local users to cause a denial of service (shutdown) by sending a shutdown command to all listening high ports.",5.5,LOCAL,LOW,LOW,NONE,UNCHANGED,NONE,NONE,HIGH
CVE-2014-0224,2014-06-05T21:55Z,2021-11-17T22:15Z,"OpenSSL before 0.9.8za, 1.0.0 before 1.0.0m, and 1.0.1 before 1.0.1h does not properly restrict processing of ChangeCipherSpec messages, which allows man-in-the-middle attackers to trigger use of a zero-length master key in certain OpenSSL-to-OpenSSL communications, and consequently hijack sessions or obtain sensitive information, via a crafted TLS handshake, aka the ""CCS Injection"" vulnerability.",7.4,NETWORK,HIGH,NONE,NONE,UNCHANGED,HIGH,HIGH,NONE
CVE-2014-0225,2017-05-25T17:29Z,2017-06-07T14:58Z,"When processing user provided XML documents, the Spring Framework 4.0.0 to 4.0.4, 3.0.0 to 3.2.8, and possibly earlier unsupported versions did not disable by default the resolution of URI references in a DTD declaration. This enabled an XXE attack.",8.8,NETWORK,LOW,NONE,REQUIRED,UNCHANGED,HIGH,HIGH,HIGH
CVE-2014-0229,2017-03-23T20:59Z,2017-03-28T18:03Z,"Apache Hadoop 0.23.x before 0.23.11 and 2.x before 2.4.1, as used in Cloudera CDH 5.0.x before 5.0.2, do not check authorization for the (1) refreshNamenodes, (2) deleteBlockPool, and (3) shutdownDatanode HDFS admin commands, which allows remote authenticated users to cause a denial of service (DataNodes shutdown) or perform unnecessary operations by issuing a command.",6.5,NETWORK,LOW,LOW,NONE,UNCHANGED,NONE,NONE,HIGH
CVE-2014-0234,2020-02-12T01:15Z,2020-02-25T18:48Z,"The default configuration of broker.conf in Red Hat OpenShift Enterprise 2.x before 2.1 has a password of ""mooo"" for a Mongo account, which allows remote attackers to hijack the broker by providing this password, related to the openshift.sh script in Openshift Extras before 20130920. NOTE: this may overlap CVE-2013-4253 and CVE-2013-4281.",9.8,NETWORK,LOW,NONE,NONE,UNCHANGED,HIGH,HIGH,HIGH
CVE-2014-0236,2016-05-16T10:59Z,2016-05-18T18:26Z,"file before 5.18, as used in the Fileinfo component in PHP before 5.6.0, allows remote attackers to cause a denial of service (NULL pointer dereference and application crash) via a zero root_storage value in a CDF file, related to cdf.c and readcdf.c.",7.5,NETWORK,LOW,NONE,NONE,UNCHANGED,NONE,NONE,HIGH
CVE-2014-0241,2019-12-13T13:15Z,2019-12-18T19:27Z,rubygem-hammer_cli_foreman: File /etc/hammer/cli.modules.d/foreman.yml world readable,5.5,LOCAL,LOW,LOW,NONE,UNCHANGED,HIGH,NONE,NONE
CVE-2014-0242,2019-12-09T20:15Z,2019-12-17T17:22Z,"mod_wsgi module before 3.4 for Apache, when used in embedded mode, might allow remote attackers to obtain sensitive information via the Content-Type header which is generated from memory that may have been freed and then overwritten by a separate thread.",7.5,NETWORK,LOW,NONE,NONE,UNCHANGED,HIGH,NONE,NONE
CVE-2014-0243,2018-07-19T17:29Z,2018-09-17T18:04Z,Check_MK through 1.2.5i2p1 allows local users to read arbitrary files via a symlink attack to a file in /var/lib/check_mk_agent/job.,5.5,LOCAL,LOW,LOW,NONE,UNCHANGED,HIGH,NONE,NONE
CVE-2014-0245,2020-01-02T20:15Z,2020-01-14T17:15Z,"It was found that the implementation of the GTNSubjectCreatingInterceptor class in gatein-wsrp was not thread safe. For a specific WSRP endpoint, under high-concurrency scenarios or scenarios where SOAP messages take long to execute, it was possible for an unauthenticated remote attacker to gain privileged information if WS-Security is enabled for the WSRP Consumer, and the endpoint in question is being used by a privileged user. This affects JBoss Portal 6.2.0.",5.9,NETWORK,HIGH,NONE,NONE,UNCHANGED,HIGH,NONE,NONE
CVE-2014-0486,2018-03-27T16:29Z,2018-04-19T17:28Z,Knot DNS before 1.5.2 allows remote attackers to cause a denial of service (application crash) via a crafted DNS message.,7.5,NETWORK,LOW,NONE,NONE,UNCHANGED,NONE,NONE,HIGH
CVE-2014-0593,2018-06-08T17:29Z,2019-10-09T23:09Z,"The set_version script as shipped with obs-service-set_version is a source validator for the Open Build Service (OBS). In versions prior to 0.5.3-1.1 this script did not properly sanitize the input provided by the user, allowing for code execution on the executing server.",9.8,NETWORK,LOW,NONE,NONE,UNCHANGED,HIGH,HIGH,HIGH
CVE-2014-0594,2018-06-08T17:29Z,2019-10-09T23:09Z,"In the Open Build Service (OBS) before version 2.4.6 the CSRF protection is incorrectly disabled in the web interface, allowing for requests without the user's consent.",8.8,NETWORK,LOW,NONE,REQUIRED,UNCHANGED,HIGH,HIGH,HIGH
CVE-2014-0691,2017-10-24T14:29Z,2017-11-14T18:38Z,"Cisco WebEx Meetings Server before 1.1 uses meeting IDs with insufficient entropy, which makes it easier for remote attackers to bypass authentication and join arbitrary meetings without a password, aka Bug ID CSCuc79643.",7.3,NETWORK,LOW,NONE,NONE,UNCHANGED,LOW,LOW,LOW
CVE-2014-0841,2018-04-27T16:29Z,2018-06-07T18:00Z,"IBM Rational Focal Point 6.4.0, 6.4.1, 6.5.1, 6.5.2, and 6.6.0 use a weak algorithm to hash passwords, which makes it easier for context-dependent attackers to obtain cleartext values via a brute-force attack. IBM X-Force ID: 90704.",5.3,LOCAL,LOW,LOW,NONE,UNCHANGED,LOW,LOW,LOW
CVE-2014-0872,2018-04-25T20:29Z,2018-06-13T11:21Z,"The installation process in IBM Security Key Lifecycle Manager 2.5 stores unencrypted credentials, which might allow local users to obtain sensitive information by leveraging root access. IBM X-Force ID: 90988.",4.1,LOCAL,HIGH,HIGH,NONE,UNCHANGED,HIGH,NONE,NONE
CVE-2014-0881,2018-04-25T20:29Z,2018-06-04T13:20Z,The TPM on Integrated Management Module II (IMM2) on IBM Flex System x222 servers with firmware 1.00 through 3.56 allows remote attackers to obtain sensitive key information or cause a denial of service by leveraging an incorrect configuration. IBM X-Force ID: 91146.,7.4,NETWORK,HIGH,NONE,NONE,UNCHANGED,HIGH,NONE,HIGH
CVE-2014-0882,2018-04-25T20:29Z,2018-06-04T13:32Z,"Integrated Management Module II (IMM2) on IBM Flex System, NeXtScale, System x3xxx, and System x iDataPlex systems might allow remote authenticated users to obtain sensitive account information via vectors related to generated Service Advisor data (FFDC). IBM X-Force ID: 91149.",6.5,NETWORK,LOW,LOW,NONE,UNCHANGED,HIGH,NONE,NONE
CVE-2014-0883,2018-04-20T21:29Z,2018-05-18T17:06Z,"Cross-site scripting (XSS) vulnerability in IBM Power Hardware Management Console (HMC) 7R7.1.0, 7R7.2.0, 7R7.3.0 through 7R7.3.5, 7R7.7.0 through SP3, and 7R7.8.0 before SP1 allows remote attackers to inject arbitrary web script or HTML via the user name on the logon screen. IBM X-Force ID: 91163.",6.1,NETWORK,LOW,NONE,REQUIRED,CHANGED,LOW,LOW,NONE
CVE-2014-0900,2018-04-20T21:29Z,2018-05-23T18:01Z,The Device Administrator code in Android before 4.4.1_r1 might allow attackers to spoof device administrators and consequently bypass MDM restrictions by leveraging failure to update the mAdminMap data structure.,8.8,NETWORK,LOW,LOW,NONE,UNCHANGED,HIGH,HIGH,HIGH
CVE-2014-0912,2018-04-20T21:29Z,2018-05-22T15:15Z,IBM Sterling B2B Integrator 5.1 and 5.2 and Sterling File Gateway 2.1 and 2.2 allow remote attackers to obtain sensitive product information via vectors related to an error page. IBM X-Force ID: 92072.,5.3,NETWORK,LOW,NONE,NONE,UNCHANGED,LOW,NONE,NONE
CVE-2014-0927,2018-04-20T21:29Z,2018-05-22T15:17Z,The ActiveMQ admin user interface in IBM Sterling B2B Integrator 5.1 and 5.2 and Sterling File Gateway 2.1 and 2.2 allows remote attackers to bypass authentication by leveraging knowledge of the port number and webapp path. IBM X-Force ID: 92259.,8.1,NETWORK,HIGH,NONE,NONE,UNCHANGED,HIGH,HIGH,HIGH
CVE-2014-0931,2018-04-20T21:29Z,2018-05-22T16:45Z,"Multiple XML external entity (XXE) vulnerabilities in the (1) CCRC WAN Server / CM Server, (2) Perl CC/CQ integration trigger scripts, (3) CMAPI Java interface, (4) ClearCase remote client, and (5) CMI and OSLC-based ClearQuest integrations components in IBM Rational ClearCase 7.1.0.x, 7.1.1.x, 7.1.2 through 7.1.2.13, 8.0 through 8.0.0.10, and 8.0.1 through 8.0.1.3 allow remote attackers to cause a denial of service or access other servers via crafted XML data. IBM X-Force ID: 92263.",9.1,NETWORK,LOW,NONE,NONE,UNCHANGED,HIGH,NONE,HIGH
CVE-2014-0950,2018-04-20T21:29Z,2018-05-24T17:54Z,"Multiple XML external entity (XXE) vulnerabilities in (1) CQWeb / CM Server, (2) ClearQuest Native client, (3) ClearQuest Eclipse client, and (4) ClearQuest Eclipse Designer components in IBM Rational ClearQuest 7.1.1 through 7.1.1.9, 7.1.2 through 7.1.2.13, 8.0.0 through 8.0.0.10, and 8.0.1 through 8.0.1.3 allow remote attackers to cause a denial of service or access other servers via crafted XML data. IBM X-Force ID: 92623.",7.1,NETWORK,LOW,LOW,NONE,UNCHANGED,LOW,NONE,HIGH
CVE-2014-0997,2017-09-26T01:29Z,2018-10-09T19:42Z,"WiFiMonitor in Android 4.4.4 as used in the Nexus 5 and 4, Android 4.2.2 as used in the LG D806, Android 4.2.2 as used in the Samsung SM-T310, Android 4.1.2 as used in the Motorola RAZR HD, and potentially other unspecified Android releases before 5.0.1 and 5.0.2 does not properly handle exceptions, which allows remote attackers to cause a denial of service (reboot) via a crafted 802.11 probe response frame.",7.5,NETWORK,LOW,NONE,NONE,UNCHANGED,NONE,NONE,HIGH
CVE-2014-10039,2018-04-18T14:29Z,2018-05-09T20:50Z,"In Android before 2018-04-05 or earlier security patch level on Qualcomm Snapdragon Mobile MDM9625, SD 400, and SD 800, calling qsee_app_entry_return() without first calling qsee_app_entry() will cause the stack to be restored to an older state resulting in a return to an unexpected location.",9.8,NETWORK,LOW,NONE,NONE,UNCHANGED,HIGH,HIGH,HIGH
CVE-2014-10043,2018-04-18T14:29Z,2018-05-09T20:51Z,"In Android before 2018-04-05 or earlier security patch level on Qualcomm Snapdragon Mobile and Snapdragon Wear MSM8909W, SD 210/SD 212/SD 205, SD 400, SD 410/12, and SD 800, while reading PlayReady rights string information from command buffer (which is sent from non-secure side), if length of rights string is very large, a buffer over read occurs, exposing TZ App memory to non-secure side.",7.5,NETWORK,LOW,NONE,NONE,UNCHANGED,HIGH,NONE,NONE
CVE-2014-10044,2018-04-18T14:29Z,2018-05-09T17:33Z,"In Android before 2018-04-05 or earlier security patch level on Qualcomm Snapdragon Mobile MDM9615, MDM9625, MDM9635M, SD 210/SD 212/SD 205, SD 400, SD 617, SD 800, and SD 820, in the time daemon, unauthorized users can potentially modify system time and cause an array index to be out-of-bound.",7.5,NETWORK,LOW,NONE,NONE,UNCHANGED,NONE,HIGH,NONE
CVE-2014-10045,2018-04-18T14:29Z,2018-05-09T17:40Z,"In Android before 2018-04-05 or earlier security patch level on Qualcomm Snapdragon Mobile and Snapdragon Wear IPQ4019, MDM9206, MDM9607, MDM9615, MDM9625, MDM9635M, MDM9640, MDM9650, MDM9655, MSM8909W, SD 210/SD 212/SD 205, SD 400, SD 410/12, SD 615/16/SD 415, SD 820, and SDX20, buffer overflow vulnerability exist in Sahara boot when program header are parsing.",9.8,NETWORK,LOW,NONE,NONE,UNCHANGED,HIGH,HIGH,HIGH
CVE-2014-10046,2018-04-18T14:29Z,2018-05-09T17:40Z,"In Android before 2018-04-05 or earlier security patch level on Qualcomm Snapdragon Mobile MDM9615, MDM9625, MDM9635M, SD 210/SD 212/SD 205, SD 400, SD 410/12, SD 615/16/SD 415, SD 800, SD 808, and SD 810, use after free vulnerability when the PDN throttle info block is freed without clearing the corresponding active timer.",9.8,NETWORK,LOW,NONE,NONE,UNCHANGED,HIGH,HIGH,HIGH
CVE-2014-10047,2018-04-18T14:29Z,2018-05-09T17:39Z,"In Android before 2018-04-05 or earlier security patch level on Qualcomm Snapdragon Mobile SD 400 and SD 800, when writing the Full Disk Encryption key to crypto engine, information leak could occur.",7.5,NETWORK,LOW,NONE,NONE,UNCHANGED,HIGH,NONE,NONE
CVE-2014-10048,2018-04-18T14:29Z,2018-05-09T17:38Z,"In Android before 2018-04-05 or earlier security patch level on Qualcomm Snapdragon Mobile and Snapdragon Wear MDM9206, MDM9607, MDM9650, MSM8909W, SD 210/SD 212/SD 205, SD 400, SD 410/12, SD 425, SD 430, SD 450, SD 600, SD 615/16/SD 415, SD 617, SD 625, SD 650/52, SD 800, SD 808, SD 810, SD 820, SD 835, and SDX20, while setting the offsets, time-services allows the user to set bases greater than valid base value which will lead to array index out-of-bound.",9.8,NETWORK,LOW,NONE,NONE,UNCHANGED,HIGH,HIGH,HIGH
CVE-2014-10050,2018-04-18T14:29Z,2018-05-09T17:37Z,"In Android before 2018-04-05 or earlier security patch level on Qualcomm Snapdragon Mobile MSM8996, MSM8939, MSM8976, MSM8917, SDM845, and SDM660, access control collision vulnerability when accessing the replay protected memory block.",9.8,NETWORK,LOW,NONE,NONE,UNCHANGED,HIGH,HIGH,HIGH
